created_utc,scraped_utc,title,author,domain,upvotes,up_time,up_seconds,target
2018-03-01 22:54:41,2018-03-02 16:00:05.883333,"Man sentenced to 12 years in prison for stomping on, throwing puppy",Kaylabel,cbsnews.com,52443,0 days 17:05:24.883333000,61524.883333000005,1
2018-03-01 14:16:13,2018-03-02 16:00:05.883562,Equifax finds an additional 2.4 million Americans impacted by 2017 breach,Hrekires,cnbc.com,25956,1 days 01:43:52.883562000,92632.883562,1
2018-03-01 22:07:45,2018-03-02 16:00:05.883672,Man accused of 'mercilessly' torturing neighbor's cat gets 15-month jail sentence,jimmyolsenblues,abcnews.go.com,5698,0 days 17:52:20.883672000,64340.883672,1
2018-03-02 01:18:04,2018-03-02 16:00:05.883771,"Google accused of excluding Asians, whites for some positions",BalboaBaggins,cnet.com,3860,0 days 14:42:01.883771000,52921.883771,1
2018-03-01 14:17:41,2018-03-02 16:00:05.883864,States consider bringing prescription drugs from Canada to US as costs soar,getBusyChild,theguardian.com,1979,1 days 01:42:24.883864000,92544.883864,1
2018-03-01 17:50:03,2018-03-02 16:00:05.883954,California ranks last in quality of life in new report,FunkMeGently,usatoday.com,1924,0 days 22:10:02.883954000,79802.883954,1
2018-03-01 14:21:58,2018-03-02 16:00:05.884043,Kushner's Business Got Loans After White House Meetings,blumberg49,nytimes.com,1857,1 days 01:38:07.884043000,92287.88404300001,1
2018-03-02 03:09:09,2018-03-02 16:00:05.884130,"Uber and Lyft drivers' median hourly wage is just $3.37, report finds",STiLL_bOoZiN,theguardian.com,2053,0 days 12:50:56.884130000,46256.884130000006,1
2018-03-01 17:44:58,2018-03-02 16:00:05.884216,Trump imposing big tariffs on steel and aluminum imports,Suberiou,bbc.co.uk,1227,0 days 22:15:07.884216000,80107.884216,1
2018-03-02 01:11:15,2018-03-02 16:00:05.884304,"The Palo Alto VA is ignoring their oncology social workers, and faking treatment time data. Social Workers who report the actual numbers are given poor performance reviews.",Sighofrelieph,abc7news.com,1260,0 days 14:48:50.884304000,53330.88430400001,1
2018-03-01 16:22:42,2018-03-02 16:00:05.884391,United Airlines moves to stop abuse of emotional support animals policy,FowelBallz,abc13.com,1108,0 days 23:37:23.884391000,85043.884391,1
2018-03-02 00:55:59,2018-03-02 16:00:05.884476,Mike Huckabee resigns from CMA Foundation board amid controversy,wesman212,tennessean.com,944,0 days 15:04:06.884476000,54246.88447600001,1
2018-03-02 07:37:15,2018-03-02 16:00:05.884608,A neurosurgeon has been suspended for opening up the head of the wrong patient in one of the worst cases of medical malpractice to become public at one of Kenya's biggest hospital,TooKnow,thekenyatoday.com,2119,0 days 08:22:50.884608000,30170.884608,1
2018-03-01 15:35:20,2018-03-02 16:00:05.884736,Star is confirmed single and ready to test Einstein’s theory.,clayt6,astronomy.com,601,1 days 00:24:45.884736000,87885.884736,1
2018-03-01 18:03:02,2018-03-02 16:00:05.884855,Vandalized Las Vegas billboard says ‘Shoot a School Kid’,OTubarao,reviewjournal.com,547,0 days 21:57:03.884855000,79023.88485500001,1
2018-03-01 15:31:38,2018-03-02 16:00:05.884973,"Medical pot helps with chronic pain, Minnesota patients report",qwheat,startribune.com,487,1 days 00:28:27.884973000,88107.88497300001,1
2018-03-01 16:50:51,2018-03-02 16:00:05.885094,50 GB of Capital One Bank data left exposed by analytics firm Birst,gex80,techrepublic.com,468,0 days 23:09:14.885094000,83354.88509400001,1
2018-03-01 19:21:38,2018-03-02 16:00:05.885217,Man who bought gun for planned church attack pleads guilty,craig1818,apnews.com,430,0 days 20:38:27.885217000,74307.885217,1
2018-03-02 06:41:44,2018-03-02 16:00:05.885345,4 Tulsa high school football players accused of raping a fellow student at the superintendents house over 6 months ago. Multiple officials being investigated for cover-up.,TalkNerdy_To_Me,tulsaworld.com,900,0 days 09:18:21.885345000,33501.885345,1
2018-03-02 11:08:58,2018-03-02 16:00:05.885434,"Lego to launch sustainable, plant-based plastic pieces",javajen84,cnbc.com,13919,0 days 04:51:07.885434000,17467.885434,1
2018-03-02 01:25:21,2018-03-02 16:00:05.885519,"Small Quebec village, sued for trying to protect its drinking water, wins legal battle",idspispopd,cbc.ca,402,0 days 14:34:44.885519000,52484.885519,1
2018-03-02 01:38:53,2018-03-02 16:00:05.885604,"Texas teen arrested with rifle, ammo near high school",jebotionmater,apnews.com,396,0 days 14:21:12.885604000,51672.885604,1
2018-03-01 15:29:09,2018-03-02 16:00:05.885690,"GE Unveils Plans To Build An Offshore Wind Turbine The Size Of A Skyscraper, The World’s Most Powerful",Melloncollieocr,ge.com,235,1 days 00:30:56.885690000,88256.88569000001,1
2018-03-02 10:19:52,2018-03-02 16:00:05.885776,Pennsylvania mayor convicted on 47 corruption charges,Caffeinetank,reuters.com,710,0 days 05:40:13.885776000,20413.885776000003,1
2018-03-01 15:50:46,2018-03-02 16:00:05.885873,"Birds Sleep in Giraffe Armpits, New Photos Reveal",craponapoopstick,news.nationalgeographic.com,186,1 days 00:09:19.885873000,86959.885873,1
2018-03-01 21:43:59,2018-03-02 16:00:05.885959,Gunmaker American Outdoor Brands plummets 20% after sales plunge,zhacker78,cnbc.com,189,0 days 18:16:06.885959000,65766.885959,1
2018-03-01 16:31:49,2018-03-02 16:00:05.886045,San Francisco cops fire 65 shots in 15 seconds at murder suspect in dramatic video,Redditsoldestaccount,foxnews.com,156,0 days 23:28:16.886045000,84496.886045,1
2018-03-01 17:43:36,2018-03-02 16:00:05.886131,Kroger-owned Fred Meyer stores won't sell guns to anyone under 21 years old,thomasscot7,money.cnn.com,156,0 days 22:16:29.886131000,80189.886131,1
2018-03-01 16:50:31,2018-03-02 16:00:05.886215,"3 siblings shot, 2 fatally, while playing cards with neighbor",Benephon,wapt.com,138,0 days 23:09:34.886215000,83374.886215,1
2018-03-01 14:25:55,2018-03-02 16:00:05.886300,"VA medical center gave inaccurate HIV test results to veterans, agency says",AudibleNod,stripes.com,129,1 days 01:34:10.886300000,92050.88630000001,1
2018-03-02 12:14:02,2018-03-02 16:00:05.886384,Polish official: Germany owes Poland $850 billion for WWII,ireallyloveflannel,apnews.com,664,0 days 03:46:03.886384000,13563.886384000001,1
2018-03-01 20:12:06,2018-03-02 16:00:05.886469,North Dakota kindergarten vaccination rates increase,dantheanchorman,bismarcktribune.com,127,0 days 19:47:59.886469000,71279.886469,1
2018-03-02 01:54:30,2018-03-02 16:00:05.886554,"Man fell ill from ricin he made, FBI agent testifies; idea said to come from 'Breaking Bad'",bookoodreaux,m.arkansasonline.com,146,0 days 14:05:35.886554000,50735.886554000004,1
2018-03-02 01:48:33,2018-03-02 16:00:05.886638,"White Supremacist Was Planning a Church Shooting, Police Say",Tf0907,time.com,134,0 days 14:11:32.886638000,51092.886638,1
2018-03-01 23:58:27,2018-03-02 16:00:05.886724,Former Georgia Medical Examiner and seven others federally indicted for opioid distribution,mikek814,justice.gov,105,0 days 16:01:38.886724000,57698.886724,1
2018-03-02 03:41:21,2018-03-02 16:00:05.886808,Video shows police kick dining homeless man out of Myrtle Beach McDonald’s,amn70,wtvr.com,135,0 days 12:18:44.886808000,44324.886808,1
2018-03-02 06:36:47,2018-03-02 16:00:05.886892,"In wake of Florida shooting, REI stops further orders from Vista Outdoors (CamelBak, Giro, Bell, Blackburn, etc.)",,newsroom.rei.com,158,0 days 09:23:18.886892000,33798.886892,1
2018-03-01 21:25:09,2018-03-02 16:00:05.886977,"No more violent video games, judge tells teen accused of making threat against school",triplesalmon,ledger-enquirer.com,95,0 days 18:34:56.886977000,66896.886977,1
2018-03-02 03:48:40,2018-03-02 16:00:05.887062,U.S. ambassador to Mexico to resign amid tense bilateral relations,welcometonutbush,reuters.com,120,0 days 12:11:25.887062000,43885.887062,1
2018-03-01 21:06:01,2018-03-02 16:00:05.887146,The widow of Orlando nightclub shooter faces federal trial,javajen84,apnews.com,94,0 days 18:54:04.887146000,68044.88714600001,1
2018-03-02 01:19:51,2018-03-02 16:00:05.887230,Ohio seventh grader who died by suicide in school bathroom planned school shooting,Eruptsion,wcpo.com,91,0 days 14:40:14.887230000,52814.88723,1
2018-03-01 21:06:19,2018-03-02 16:00:05.887314,Pro-gun lawmakers win victory over Delta,jebotionmater,apnews.com,84,0 days 18:53:46.887314000,68026.887314,1
2018-03-02 03:08:23,2018-03-02 16:00:05.887398,Tardigrade: New species discovered in Japan parking lot,KinnerNevada,usatoday.com,97,0 days 12:51:42.887398000,46302.887398000006,1
2018-03-01 18:23:08,2018-03-02 16:00:05.887483,Alleged Kremlin call girl begs for U.S. rescue from Thai jail,AggressiveVacuuming,usatoday.com,79,0 days 21:36:57.887483000,77817.887483,1
2018-03-01 15:40:56,2018-03-02 16:00:05.887567,North Korea is helping Syria build chemical weapons: UN experts,shatruvns,indiatoday.in,84,1 days 00:19:09.887567000,87549.88756700001,1
2018-03-02 08:17:52,2018-03-02 16:00:05.887651,West Virginia teacher strike reaches 7 days without classes,ireallyloveflannel,apnews.com,168,0 days 07:42:13.887651000,27733.887651,1
2018-03-01 21:42:37,2018-03-02 16:00:05.887735,Blackout hits Puerto Rico after 2 power plants shut down,AudibleNod,stripes.com,68,0 days 18:17:28.887735000,65848.88773500001,1
2018-03-02 04:31:17,2018-03-02 16:00:05.887820,San Francisco pouring more money to defend detained undocumented immigrants,9magsz,abc7news.com,93,0 days 11:28:48.887820000,41328.88782,1
2018-03-01 20:33:02,2018-03-02 16:00:05.887905,Hunter College files eviction lawsuit against dropout who refuses to move out of dorm room,Da_Fish,independent.co.uk,57,0 days 19:27:03.887905000,70023.88790500001,0
2018-03-01 17:36:25,2018-03-02 16:00:05.887990,Justice Department asked Wells Fargo to probe wealth management unit: WSJ,Synesthesia108,reuters.com,54,0 days 22:23:40.887990000,80620.88799,0
2018-03-02 03:18:26,2018-03-02 16:00:05.888074,Couple arrested after 3 children found living in plywood box for years,hannafinjones,fox5sandiego.com,54,0 days 12:41:39.888074000,45699.888074,0
2018-03-01 19:40:45,2018-03-02 16:00:05.888158,"Las Vegas police search for suspect in shooting at Las Vegas Lounge, one of the three transgender bars in the country",dammitqueer,fox5vegas.com,50,0 days 20:19:20.888158000,73160.888158,0
2018-03-02 01:37:33,2018-03-02 16:00:05.888240,Ga. teacher gun suspect torched car in previous rifle incident: police report,dangerouslesbian,cbsnews.com,48,0 days 14:22:32.888240000,51752.88824,0
2018-03-01 18:51:44,2018-03-02 16:00:05.888324,Cyber-attack on German government IT network 'ongoing',Mr_Roy18,bbc.com,47,0 days 21:08:21.888324000,76101.888324,0
2018-03-02 03:56:43,2018-03-02 16:00:05.888408,"'Shoot a school kid only $29,' says vandalized Vegas firing range billboard - CNN",XiCor122,edition.cnn.com,48,0 days 12:03:22.888408000,43402.888408000006,0
2018-03-01 15:54:31,2018-03-02 16:00:05.888492,Dog with deformed snout receives 'Diamond Collar Award' from OHS,crumbbelly,kptv.com,46,1 days 00:05:34.888492000,86734.888492,0
2018-03-02 06:21:51,2018-03-02 16:00:05.888575,Louisiana mother charged with killing 1-year-old daughter in crash she didn’t cause,cookiesandmilk41790,abcnews.go.com,63,0 days 09:38:14.888575000,34694.888575000004,1
2018-03-02 01:24:57,2018-03-02 16:00:05.888659,"Joshua Tree couple arrested after locking three kids in box for four years, authorities say",summerofevidence,latimes.com,46,0 days 14:35:08.888659000,52508.888659000004,0
2018-03-02 01:19:46,2018-03-02 16:00:05.888744,Harvey Weinstein 'Casting Couch' statue unveiled ahead of Oscars,jebotionmater,reuters.com,43,0 days 14:40:19.888744000,52819.888744,0
2018-03-02 04:55:56,2018-03-02 16:00:05.888829,Justice Dept. Reviewing Schaaf ICE Raid Warning,traunkss,sanfrancisco.cbslocal.com,45,0 days 11:04:09.888829000,39849.888829,0
2018-03-01 23:47:00,2018-03-02 16:00:05.888915,Driver found guilty of criminally negligent homicide in bus crash that killed 6 children,bandak38134,abcnews.go.com,36,0 days 16:13:05.888915000,58385.888915,0
2018-03-02 02:10:31,2018-03-02 16:00:05.889000,International Gymnast Magazine Online - First Male Victim Files Suit in Nassar Case,deftonesdid911,intlgymnast.com,43,0 days 13:49:34.889000000,49774.889,0
2018-03-01 20:34:24,2018-03-02 16:00:05.889084,Friendly fire killed deputy marshal in Harrisburg shootout: Sources,Redman2009,pennlive.com,37,0 days 19:25:41.889084000,69941.88908400001,0
2018-03-01 21:25:34,2018-03-02 16:00:05.889169,"Home intruder kills dog, falls asleep in homeowner’s bed",ireallyloveflannel,cbsnews.com,37,0 days 18:34:31.889169000,66871.889169,0
2018-03-02 04:21:28,2018-03-02 16:00:05.889254,Body of missing Virginia mom found a mile from her home; 23-year-old man charged,traunkss,fox2now.com,44,0 days 11:38:37.889254000,41917.889254,0
2018-03-02 01:10:41,2018-03-02 16:00:05.889338,"Denver teen kills 37-year-old ex-girlfriend, before shooting himself",washheightsboy3,denverpost.com,36,0 days 14:49:24.889338000,53364.889338,0
2018-03-02 12:29:04,2018-03-02 16:00:05.889422,Group takes credit for Vegas 'Shoot a School Kid' billboard,welcometonutbush,apnews.com,162,0 days 03:31:01.889422000,12661.889422,1
2018-03-02 02:09:49,2018-03-02 16:00:05.889507,US announces sale of anti-tank missiles to Ukraine over Russian opposition,javajen84,abcnews.go.com,40,0 days 13:50:16.889507000,49816.889507,0
2018-03-02 00:31:07,2018-03-02 16:00:05.889591,Russia opens contest to name their new missile systems,ArmaggedonPSA,vote.mil.ru,32,0 days 15:28:58.889591000,55738.88959100001,0
2018-03-02 00:30:59,2018-03-02 16:00:05.889676,NASA launches advanced weather satellite for western US,javajen84,apnews.com,32,0 days 15:29:06.889676000,55746.889676000006,0
2018-03-01 21:29:56,2018-03-02 16:00:05.889760,Report: Cops dealt before with lockdown-causing Georgia teacher,ireallyloveflannel,cbsnews.com,30,0 days 18:30:09.889760000,66609.88976,0
2018-03-01 14:55:10,2018-03-02 16:00:05.889855,"Man accused of stealing more than $280,000 from dead uncle's military pension",AudibleNod,stripes.com,29,1 days 01:04:55.889855000,90295.889855,0
2018-03-01 23:29:32,2018-03-02 16:00:05.889943,Court upholds ending 'no sea otter zone' on California coast,undue-influence,ksbw.com,33,0 days 16:30:33.889943000,59433.889943,0
2018-03-01 18:04:57,2018-03-02 16:00:05.890030,Crossing guard charged with selling marijuana while working,mikek814,apnews.com,31,0 days 21:55:08.890030000,78908.89003000001,0
2018-03-02 04:12:57,2018-03-02 16:00:05.890116,Female-led investor group to buy Weinstein Co assets,temporarycreature,reuters.com,29,0 days 11:47:08.890116000,42428.890116,0
2018-03-02 08:47:11,2018-03-02 16:00:05.890201,World's last male northern white rhino is gravely ill,javajen84,cnn.com,58,0 days 07:12:54.890201000,25974.890201000002,0
2018-03-01 22:57:58,2018-03-02 16:00:05.890285,10-year-old boy arrested for allegedly emailing school shooting threats: Police,dangerouslesbian,abcnews.go.com,26,0 days 17:02:07.890285000,61327.890285,0
2018-03-01 20:53:56,2018-03-02 16:00:05.890370,American Airlines is the latest to add ‘basic economy’ fares to international flights,GriffonsChainsaw,theverge.com,25,0 days 19:06:09.890370000,68769.89037000001,0
2018-03-02 01:29:05,2018-03-02 16:00:05.890455,New Orleans alleged to have secretly used Palantir predictive policing,Redrrosa,csoonline.com,22,0 days 14:31:00.890455000,52260.890455,0
2018-03-01 20:21:01,2018-03-02 16:00:05.890539,California county orders evacuations ahead of possible mudslides,throwaway_ghast,cbsnews.com,23,0 days 19:39:04.890539000,70744.890539,0
2018-03-02 05:00:10,2018-03-02 16:00:05.890623,"Dangerous nor'easter targets East Coast with snow, rain, wind",demonicmax56,cbsnews.com,28,0 days 10:59:55.890623000,39595.890623,0
2018-03-02 01:26:09,2018-03-02 16:00:05.890708,Miami VA investigation finds discrepancies in veteran HIV tests — some were positive,thinkB4WeSpeak,miamiherald.com,24,0 days 14:33:56.890708000,52436.890708000006,0
2018-03-01 20:27:58,2018-03-02 16:00:05.890791,"Man accused of sending vile letters with ‘suspicious white powder’ to Trump Jr., Sen. Stabenow",USARSUPTHAI69,washingtonpost.com,19,0 days 19:32:07.890791000,70327.890791,0
2018-03-01 17:24:30,2018-03-02 16:00:05.890876,Corsicana removes gorilla statue from park amid racial complaints,redb2112,fox4news.com,18,0 days 22:35:35.890876000,81335.890876,0
2018-03-01 15:15:55,2018-03-02 16:00:05.890961,Mountain Equipment Co-op to stop selling Vista Outdoor products,qwheat,cbc.ca,18,1 days 00:44:10.890961000,89050.89096100001,0
2018-03-01 14:23:15,2018-03-02 16:00:05.891045,"Roaches in the plantain chips, on the meat slicer and all around close 15 restaurants",eggslutchoe,miamiherald.com,17,1 days 01:36:50.891045000,92210.89104500001,0
2018-03-02 08:28:43,2018-03-02 16:00:05.891129,Elon Musk responds to a Harvard professor's comments on A.I.: ‘Humanity is in deep trouble’,timmyaS,cnbc.com,24,0 days 07:31:22.891129000,27082.891129000003,0
2018-03-02 05:25:57,2018-03-02 16:00:05.891213,"Nurse faces 60 years in murder, dismemberment of college student",9magsz,ctpost.com,18,0 days 10:34:08.891213000,38048.891213,0
2018-03-02 03:02:32,2018-03-02 16:00:05.891297,A freshman wrestler at Wilmington High School said he left the team after a coach revealed his transgender identity in front of his classmates.,GriffonsChainsaw,kmov.com,21,0 days 12:57:33.891297000,46653.891297,0
2018-03-01 22:45:05,2018-03-02 16:00:05.891382,Major data breach at Marine Forces Reserve impacts thousands,Shogouki,marinecorpstimes.com,18,0 days 17:15:00.891382000,62100.891382,0
2018-03-01 22:40:34,2018-03-02 16:00:05.891467,Medical cannabis bill heads to VA governor’s desk; what happens next,GatorNelson,newsleader.com,17,0 days 17:19:31.891467000,62371.891467,0
2018-03-01 22:26:20,2018-03-02 16:00:05.891551,Uber and Lyft looking to monopolize self-driving cars,uhkayus,fee.org,16,0 days 17:33:45.891551000,63225.891551,0
2018-03-02 07:03:21,2018-03-02 16:00:05.891636,Tens of thousands of Californians evacuate as storm brings mudslide risk,cookiesandmilk41790,cnn.com,19,0 days 08:56:44.891636000,32204.891636,0
2018-03-01 17:00:02,2018-03-02 16:00:05.891720,Greenburgh residents say snail mail is failing them,discocrisco,lohud.com,14,0 days 23:00:03.891720000,82803.89172,0
2018-03-02 00:17:05,2018-03-02 16:00:05.891803,Wave of layoffs continues at Ascension St. John,thinkB4WeSpeak,crainsdetroit.com,15,0 days 15:43:00.891803000,56580.891803000006,0
2018-03-01 20:13:56,2018-03-02 16:00:05.891887,Weather forecast: Nor'easter has almost all East Coast is under watch,interested21,usatoday.com,17,0 days 19:46:09.891887000,71169.891887,0
2018-03-02 05:58:47,2018-03-02 16:00:05.891971,US accuses Russia of breaching treaties with 'invincible' weapons,BuzzAldrinsPunch,24matins.uk,16,0 days 10:01:18.891971000,36078.891971000005,0
2018-03-01 23:18:35,2018-03-02 16:00:05.892056,"At nanny murder trial, mother recounts 'horror' of seeing her 2 kids dead",dangerouslesbian,abcnews.go.com,14,0 days 16:41:30.892056000,60090.892056000004,0
2018-03-01 22:51:37,2018-03-02 16:00:05.892140,Barbecue championships see Australians cook Texans' reputation,LuckyBdx4,abc.net.au,15,0 days 17:08:28.892140000,61708.89214,0
2018-03-01 23:42:24,2018-03-02 16:00:05.892224,California's gun seizure squad finds an arsenal under a bed,wazzel2u,cnn.com,11,0 days 16:17:41.892224000,58661.892224,0
