created_utc,scraped_utc,title,author,domain,upvotes,up_time,up_seconds,target
2018-03-03 21:58:18,2018-03-04 16:14:29.157381,Kansas man wrongfully imprisoned for 23 years receives no compensation from state,cookiesandmilk41790,cbsnews.com,56710,0 days 18:16:11.157381000,65771.157381,1
2018-03-03 17:24:06,2018-03-04 16:14:29.163277,Secret Service: Person allegedly suffered self-inflicted gunshot wound near White House,carter1984,wbaltv.com,28299,0 days 22:50:23.163277000,82223.163277,1
2018-03-04 07:08:02,2018-03-04 16:14:29.163427,Washington Legislature approves gay conversion therapy ban,javajen84,king5.com,24484,0 days 09:06:27.163427000,32787.163427,1
2018-03-03 17:52:08,2018-03-04 16:14:29.163528,"Canada, top exporter of steel and aluminum to U.S., 'flabbergasted' by tariff proposals",zz2113,latimes.com,10126,0 days 22:22:21.163528000,80541.163528,1
2018-03-03 21:20:49,2018-03-04 16:14:29.163620,Philando Castile charity wipes out school lunch debt in district where he worked,Xerxestheokay,cnn.com,7226,0 days 18:53:40.163620000,68020.16362,1
2018-03-03 17:21:52,2018-03-04 16:14:29.163712,"‘Hate wins,’ says Mike Huckabee as he resigns from country music organization after backlash",Bemuzed,washingtonpost.com,3615,0 days 22:52:37.163712000,82357.16371200001,1
2018-03-03 16:51:00,2018-03-04 16:14:29.163800,California teen arrested for alleged school threat with AR-15 Lego gun,andrewshepherdlego,mercurynews.com,3056,0 days 23:23:29.163800000,84209.16380000001,1
2018-03-03 20:08:25,2018-03-04 16:14:29.163888,A former Harris County prosecutor withheld a key email that helped establish a clear alibi for Alfred Dewayne Brown in the high-profile murder case that eventually sent him to death row,IAmNotTheEnemy,chron.com,1831,0 days 20:06:04.163888000,72364.16388800001,1
2018-03-03 20:07:52,2018-03-04 16:14:29.163975,Advertisers flee InfoWars founder Alex Jones' YouTube channel,LimpRoarer,money.cnn.com,1646,0 days 20:06:37.163975000,72397.163975,1
2018-03-03 17:13:20,2018-03-04 16:14:29.164063,"Parkland Survivor Accuses Teacher, Called a Hero, of Being 'Coward' Who Locked Students Out of Classroom During Shooting",ParagonExample,popculture.com,1341,0 days 23:01:09.164063000,82869.164063,1
2018-03-03 16:25:43,2018-03-04 16:14:29.164150,"Central Michigan student wasn't 'making a lot of sense' before killing parents, police say",unusualspecialist,cnn.com,1289,0 days 23:48:46.164150000,85726.16415000001,1
2018-03-03 17:37:20,2018-03-04 16:14:29.164236,Colorado child sex offender goes free; not required to register as offender.,Atticus034,usatoday.com,1125,0 days 22:37:09.164236000,81429.16423600001,1
2018-03-04 04:22:17,2018-03-04 16:14:29.164321,"Florida teacher hosts white nationalist podcast, HuffPost reports",DingDongInDaPingPong,tampabay.com,919,0 days 11:52:12.164321000,42732.164321000004,1
2018-03-03 16:59:19,2018-03-04 16:14:29.164407,"Man tied cinder block to dog, threw him in Maryland's Liberty Reservoir, prosecutors say",dangerouslesbian,cbsnews.com,700,0 days 23:15:10.164407000,83710.164407,1
2018-03-03 16:50:31,2018-03-04 16:14:29.164494,"Vatican indicts ex-bank head, says embezzlement loss is $62M",dangerouslesbian,apnews.com,488,0 days 23:23:58.164494000,84238.16449400001,1
2018-03-03 19:13:43,2018-03-04 16:14:29.164580,"Wichita church enabled years of sex abuse by youth pastor, lawsuit says",FowelBallz,kansas.com,351,0 days 21:00:46.164580000,75646.16458000001,1
2018-03-03 20:42:04,2018-03-04 16:14:29.164666,Oklahoma teachers planning a statewide strike,brashendeavors,ktul.com,341,0 days 19:32:25.164666000,70345.16466600001,1
2018-03-04 01:28:35,2018-03-04 16:14:29.164753,Teachers say they'll stay out on strike,jebotionmater,apnews.com,349,0 days 14:45:54.164753000,53154.164753000005,1
2018-03-03 16:49:10,2018-03-04 16:14:29.164838,U.N. halts aid work in northeast Nigeria town after humanitarian workers killed,conuly,ca.reuters.com,296,0 days 23:25:19.164838000,84319.16483800001,1
2018-03-03 16:12:42,2018-03-04 16:14:29.164924,2 Detroit police officers charged with willful neglect of duty in fatal crash,craponapoopstick,fox2detroit.com,263,1 days 00:01:47.164924000,86507.16492400001,1
2018-03-03 20:49:59,2018-03-04 16:14:29.165009,"2 Missouri men sentenced for killing kitten, posting video",SnickersTheDog,kmbc.com,234,0 days 19:24:30.165009000,69870.165009,1
2018-03-04 12:02:50,2018-03-04 16:14:29.165095,United changes employee bonus program to a lottery,manny7064,thepointsguy.com,451,0 days 04:11:39.165095000,15099.165095,1
2018-03-03 20:10:03,2018-03-04 16:14:29.165180,Hand Grenades and Gang Violence Rattle Sweden’s Middle Class,cleancutmover,nytimes.com,171,0 days 20:04:26.165180000,72266.16518000001,1
2018-03-03 17:59:58,2018-03-04 16:14:29.165263,Man kidnapped and killed three-week-old girl and shot her parents,Norn-Iron,news.sky.com,156,0 days 22:14:31.165263000,80071.165263,1
2018-03-03 17:35:39,2018-03-04 16:14:29.165368,Massachusetts trooper accused of racist posts,javajen84,cnn.com,143,0 days 22:38:50.165368000,81530.165368,1
2018-03-03 21:01:56,2018-03-04 16:14:29.165494,"State says they mishandled report of abuse before 3-yr-old Kansas boy was killed, found encased in concrete, records show",nicholemanna,kansas.com,124,0 days 19:12:33.165494000,69153.165494,1
2018-03-03 16:45:06,2018-03-04 16:14:29.165590,Ethnic clashes in northeastern Congo kill more than 40 people,conuly,ca.reuters.com,120,0 days 23:29:23.165590000,84563.16559,1
2018-03-04 09:29:00,2018-03-04 16:14:29.165679,Sex to boost film career is 'not rape': Weinstein lawyer,Nergaal,straitstimes.com,223,0 days 06:45:29.165679000,24329.165679,1
2018-03-03 20:45:32,2018-03-04 16:14:29.165766,"White supremacist who admired Dylann Roof, hated Jews, Muslims, arrested at Myrtle Beach hotel",amtcp,wyff4.com,119,0 days 19:28:57.165766000,70137.165766,1
2018-03-03 23:53:37,2018-03-04 16:14:29.165852,"Man caused train crashes then left Arabic messages to provoke anti-Muslim backlash, prosecutors say",LevantineLion,independent.co.uk,114,0 days 16:20:52.165852000,58852.165852000006,1
2018-03-04 05:35:05,2018-03-04 16:14:29.165938,Electrolux halts Tennessee project after tariff announcement,ireallyloveflannel,abcnews.go.com,121,0 days 10:39:24.165938000,38364.165938000006,1
2018-03-04 05:43:06,2018-03-04 16:14:29.166024,Bosses at world's most ambitious clean coal plant kept problems secret for years.,tsvoltmet,theguardian.com,110,0 days 10:31:23.166024000,37883.166024000006,1
2018-03-03 21:51:09,2018-03-04 16:14:29.166111,Sheriff: Oglethorpe deputy caught selling meth in patrol car,relevantlife,fox5atlanta.com,100,0 days 18:23:20.166111000,66200.166111,1
2018-03-04 06:50:15,2018-03-04 16:14:29.166195,China says it does not want a trade war with U.S,cookiesandmilk41790,reuters.com,118,0 days 09:24:14.166195000,33854.166195000005,1
2018-03-04 00:13:31,2018-03-04 16:14:29.166280,DA: Former prosecutor withheld key email in death row case - Houston Chronicle,Darrkman,m.chron.com,81,0 days 16:00:58.166280000,57658.166280000005,1
2018-03-03 23:20:19,2018-03-04 16:14:29.166365,"Deputy fired, arrested after allegedly making a ride along expose herself",discocrisco,wctv.tv,84,0 days 16:54:10.166365000,60850.166365000005,1
2018-03-03 20:24:46,2018-03-04 16:14:29.166451,Woman arrested after driving gun shot victim to hospital under the influence,SnickersTheDog,fox13now.com,74,0 days 19:49:43.166451000,71383.166451,1
2018-03-04 00:59:34,2018-03-04 16:14:29.166555,Ben Cohen of Ben and Jerry's arrested for violating noise ordinance,killern00t54,usatoday.com,72,0 days 15:14:55.166555000,54895.166555,1
2018-03-03 23:15:21,2018-03-04 16:14:29.166643,"Woman Who Was Stabbed, Nearly Raped During Santa Monica Home-Invasion Robbery Speaks Out",traunkss,ktla.com,67,0 days 16:59:08.166643000,61148.166643000004,0
2018-03-04 11:24:27,2018-03-04 16:14:29.166729,BBC News: Sir Roger Bannister: First man to run a mile in under four minutes dies at 88,Consiliarius,bbc.co.uk,112,0 days 04:50:02.166729000,17402.166729,1
2018-03-03 20:26:56,2018-03-04 16:14:29.166814,Mammoth Mountain ski resort closed after 'major avalanche',SnickersTheDog,abc7.com,49,0 days 19:47:33.166814000,71253.16681400001,0
2018-03-04 09:19:28,2018-03-04 16:14:29.166900,Man issues warning after losing thousands during online monkey purchase,javajen84,fox17online.com,59,0 days 06:55:01.166900000,24901.1669,0
2018-03-03 16:36:41,2018-03-04 16:14:29.166986,"Turkish warplanes hit pro-Syrian government forces in Afrin, kill 36: monitor",conuly,reuters.com,44,0 days 23:37:48.166986000,85068.16698600001,0
2018-03-03 23:47:08,2018-03-04 16:14:29.167071,Polish group sues Argentine paper under new Holocaust law,DingDongInDaPingPong,reuters.com,44,0 days 16:27:21.167071000,59241.167071,0
2018-03-04 01:23:01,2018-03-04 16:14:29.167156,FBI director makes historic visit to Navajo Nation,jebotionmater,apnews.com,40,0 days 14:51:28.167156000,53488.167156,0
2018-03-04 08:13:57,2018-03-04 16:14:29.167240,Salmonella found in yet another dog food brand causes recall reaching 21 states,welcometonutbush,miamiherald.com,49,0 days 08:00:32.167240000,28832.167240000002,0
2018-03-03 22:07:13,2018-03-04 16:14:29.167326,Second family member arrested in killing of man over Colorado ranch worth millions,T-Hampton,foxnews.com,38,0 days 18:07:16.167326000,65236.167326,0
2018-03-03 20:01:17,2018-03-04 16:14:29.167412,"Chased by a stranger, woman fears iPhone setting may have left her vulnerable",IBiteYou,gosanangelo.com,32,0 days 20:13:12.167412000,72792.16741200001,0
2018-03-04 13:21:00,2018-03-04 16:14:29.167498,China sets stage for Xi's historic grab to rule indefinitely,strtyp,hosted2.ap.org,83,0 days 02:53:29.167498000,10409.167498,1
2018-03-04 14:05:38,2018-03-04 16:14:29.167583,"Missouri man, who once threatened to 'kill all white people,' is indicted in 2nd set of 3 killings",undue-influence,foxnews.com,113,0 days 02:08:51.167583000,7731.167583,1
2018-03-04 12:22:58,2018-03-04 16:14:29.167668,Frontier Communications Workers in West Virginia and Virginia on Strike,brashendeavors,cwa-union.org,62,0 days 03:51:31.167668000,13891.167668,0
2018-03-04 01:24:07,2018-03-04 16:14:29.167752,"3 children in back of stolen vehicle found safe near Cincinnati, Ohio",dangerouslesbian,cbsnews.com,27,0 days 14:50:22.167752000,53422.167752,0
2018-03-03 18:44:48,2018-03-04 16:14:29.167837,Prostate test 'breakthrough' in NHS trial,BingoLuck,bbc.co.uk,22,0 days 21:29:41.167837000,77381.167837,0
2018-03-03 16:38:48,2018-03-04 16:14:29.167922,"Suspect in Central Michigan shooting death used gun registered to dad, police say",ExpensiveWerewolf,usatoday.com,23,0 days 23:35:41.167922000,84941.16792200001,0
2018-03-03 23:48:38,2018-03-04 16:14:29.168007,Forklift smashes hole in Lloyds Bank during cash machine raid,speedraceroncrack,bbc.com,22,0 days 16:25:51.168007000,59151.168007,0
2018-03-04 01:08:03,2018-03-04 16:14:29.168091,Florida python devours deer that weighs nearly 4 lbs. more,javajen84,apnews.com,21,0 days 15:06:26.168091000,54386.16809100001,0
2018-03-04 12:22:37,2018-03-04 16:14:29.168177,Six hundred bitcoin mining computers stolen in Iceland,Danyo-,independent.co.uk,22,0 days 03:51:52.168177000,13912.168177000001,0
2018-03-03 20:28:41,2018-03-04 16:14:29.168263,"Duo Recruited Girls Into Sex Trafficking, Plied Them With Drugs",SnickersTheDog,detroit.cbslocal.com,16,0 days 19:45:48.168263000,71148.168263,0
2018-03-03 21:56:51,2018-03-04 16:14:29.168348,Police: Woman reports stabbing boyfriend with sword,SnickersTheDog,khq.com,19,0 days 18:17:38.168348000,65858.168348,0
2018-03-03 21:25:03,2018-03-04 16:14:29.168434,Toronto police reject The Social co-host Marci Ien’s claims of racism,Demalos,theglobeandmail.com,14,0 days 18:49:26.168434000,67766.168434,0
2018-03-04 00:20:43,2018-03-04 16:14:29.168520,Florida lawmakers pass school-safety bill in rare session,paulfromatlanta,cbs46.com,15,0 days 15:53:46.168520000,57226.16852000001,0
2018-03-04 07:39:51,2018-03-04 16:14:29.168605,"Street terrorism, gang charges filed against teen allegedly found with gun at Concord high school",cookiesandmilk41790,eastbaytimes.com,18,0 days 08:34:38.168605000,30878.168605000003,0
2018-03-04 03:14:20,2018-03-04 16:14:29.168691,Missouri principal invents new lock to prevent school shootings,-clinton-,ky3.com,14,0 days 13:00:09.168691000,46809.168691000006,0
2018-03-03 15:39:08,2018-03-04 16:14:29.168776,Paris metro: Pregnant Frenchwoman fined for walking wrong way,mxzbzz,bbc.co.uk,15,1 days 00:35:21.168776000,88521.168776,0
2018-03-03 22:25:38,2018-03-04 16:14:29.168861,Dallas apartment manager killed by former security guard,traunkss,fox4news.com,12,0 days 17:48:51.168861000,64131.168861000006,0
2018-03-03 21:22:31,2018-03-04 16:14:29.168946,Accused War Criminal Cites Torture Fears To Avoid Deportation,traunkss,wbur.org,11,0 days 18:51:58.168946000,67918.168946,0
2018-03-03 16:28:00,2018-03-04 16:14:29.169031,Ten injured in clashes as police break up protest camp in Ukraine,conuly,in.reuters.com,12,0 days 23:46:29.169031000,85589.16903100001,0
2018-03-03 18:05:50,2018-03-04 16:14:29.169116,Art critic Gillo Dorfles dead at 107,yeskevinlad277,ansa.it,11,0 days 22:08:39.169116000,79719.169116,0
2018-03-04 11:28:33,2018-03-04 16:14:29.169200,Fiorentina captain found dead in hotel room - reports,Highfaluter,news.sky.com,14,0 days 04:45:56.169200000,17156.1692,0
2018-03-04 02:25:59,2018-03-04 16:14:29.169285,"Scholar stabbed on Bangladesh university campus, terror angle yet to be determined",shatruvns,indiatoday.in,10,0 days 13:48:30.169285000,49710.169285,0
2018-03-04 01:21:21,2018-03-04 16:14:29.169371,Florida lawmakers debate school-safety bill in rare session,jebotionmater,apnews.com,11,0 days 14:53:08.169371000,53588.169371,0
2018-03-04 07:25:29,2018-03-04 16:14:29.169455,Woman dies at pharmaceutical testing lab in Uwchlan,hallowishes,dailylocal.com,11,0 days 08:49:00.169455000,31740.169455000003,0
2018-03-04 01:11:05,2018-03-04 16:14:29.169540,Video captures train derailment in Eastern Ontario,headtailgrep,iheartradio.ca,9,0 days 15:03:24.169540000,54204.16954,0
2018-03-04 13:13:05,2018-03-04 16:14:29.169625,"Fairbanks Four: We have freedom, now we want justice 🇺🇸",boppinmule,news.com.au,13,0 days 03:01:24.169625000,10884.169625,0
2018-03-04 07:00:21,2018-03-04 16:14:29.169711,South Korea to send high-level officials to North for talks,SnickersTheDog,apnews.com,10,0 days 09:14:08.169711000,33248.169711,0
2018-03-04 07:29:02,2018-03-04 16:14:29.169797,Dozens of fighters killed in Turkish airstrikes in Afrin,artbyash,google.co.in,8,0 days 08:45:27.169797000,31527.169797000002,0
2018-03-04 04:23:25,2018-03-04 16:14:29.169882,"The moon formed inside a hot cosmic doughnut, scientists say",keypuncher,nbcnews.com,3,0 days 11:51:04.169882000,42664.169882,0
2018-03-04 15:00:18,2018-03-04 16:14:29.169968,Hand Grenades and Gang Violence Rattle Sweden’s Middle Class - The New York Times,littleirishmaid,nytimes.com,16,0 days 01:14:11.169968000,4451.169968,0
2018-03-04 14:42:33,2018-03-04 16:14:29.170053,Mammoth avalanche closes resort and triggers emergency response,bionicnomad,latimes.com,7,0 days 01:31:56.170053000,5516.170053000001,0
2018-03-04 03:43:47,2018-03-04 16:14:29.170139,"North Korea, Seeking ‘Equal Footing,’ Rejects Preconditions for U.S. Talks",bustead,nytimes.com,0,0 days 12:30:42.170139000,45042.170139,0
2018-03-03 19:36:27,2018-03-04 16:14:29.170224,Fired Texas Wesleyan coach says controversial pot email was free speech,redb2112,fox4news.com,1,0 days 20:38:02.170224000,74282.170224,0
2018-03-03 23:09:40,2018-03-04 16:14:29.170308,Some NBA teams played 'negro national anthem' at games,9magsz,fox5ny.com,0,0 days 17:04:49.170308000,61489.170308,0
2018-03-04 08:24:26,2018-03-04 16:14:29.170392,"Woman dumped popcorn on 2-year-old girl during movie, police say",SnickersTheDog,foxnews.com,0,0 days 07:50:03.170392000,28203.170392,0
