created_utc,scraped_utc,title,author,domain,upvotes,up_time,up_seconds,target
2018-03-06 13:11:45,2018-03-07 02:22:07.327968,Judge declares man's truck 'his home' in ruling that could affect hundreds of homeless people,cantstopthebald,fox13memphis.com,54581,0 days 13:10:22.327968000,47422.327968000005,1
2018-03-06 17:32:05,2018-03-07 02:22:07.349924,Alabama man arrested 4 days after criticizing his local sheriff has been released from jail amid public outcry,casac8,al.com,22275,0 days 08:50:02.349924000,31802.349924000002,1
2018-03-06 11:37:34,2018-03-07 02:22:07.350049,"20-year-old sues Dick's, Walmart over 21-and-over gun sales",konorM,nbcnews.com,2370,0 days 14:44:33.350049000,53073.350049,1
2018-03-06 15:07:20,2018-03-07 02:22:07.350167,West Virginia Governor Justice Announces 5% Raise to All Public Employees Ending Teacher Strike,CGrizzy6,wvmetronews.com,1594,0 days 11:14:47.350167000,40487.350167000004,1
2018-03-06 12:29:44,2018-03-07 02:22:07.350282,"North Korea Is Willing to Discuss Giving Up Nuclear Weapons, South Says",undergroundaleroad,nytimes.com,1351,0 days 13:52:23.350282000,49943.35028200001,1
2018-03-06 15:53:11,2018-03-07 02:22:07.350373,Dad punishes 'bully' son by making him run to school,noiwontpickaname,nbc-2.com,1085,0 days 10:28:56.350373000,37736.350373,1
2018-03-06 12:38:40,2018-03-07 02:22:07.350460,"Rifle, ammo taken, student charged with Dunbar High shooting threat",Raptors_King,kentucky.com,983,0 days 13:43:27.350460000,49407.35046,1
2018-03-06 18:01:14,2018-03-07 02:22:07.350546,Prosecutors ask judge to put 'pharma bro' Martin Shkreli in prison for at least 15 years,ths1977,cnbc.com,967,0 days 08:20:53.350546000,30053.350546,1
2018-03-06 18:48:44,2018-03-07 02:22:07.350631,"Coast Guard responders harmed by chemicals used to clean up BP oil spill, research shows",soopninjas,nola.com,938,0 days 07:33:23.350631000,27203.350631,1
2018-03-06 03:14:02,2018-03-07 02:22:07.350717,Reddit Rises Up Against CEO for Hiding Russian Trolls,hannafinjones,thedailybeast.com,673,0 days 23:08:05.350717000,83285.35071700001,1
2018-03-06 14:10:05,2018-03-07 02:22:07.350802,France to set age of sexual consent at 15 after rape outcry,Thanks_Soros_Money,amp.cnn.com,585,0 days 12:12:02.350802000,43922.350802,1
2018-03-06 20:12:16,2018-03-07 02:22:07.350886,Idaho can no longer automatically bar trans people from altering birth certificates,GriffonsChainsaw,idahostatesman.com,532,0 days 06:09:51.350886000,22191.350886,1
2018-03-06 11:57:55,2018-03-07 02:22:07.350969,North and South Korea agree to hold summit in April,ths1977,cnn.com,475,0 days 14:24:12.350969000,51852.35096900001,1
2018-03-06 22:48:42,2018-03-07 02:22:07.351052,"Monsanto concealed effects of toxic chemical for decades, Ohio AG says in suit",lord_funky_biscuit,nbcnews.com,578,0 days 03:33:25.351052000,12805.351052,1
2018-03-06 05:00:59,2018-03-07 02:22:07.351135,Florida Senate passes bill raising age to buy guns,Plainchant,cnn.com,437,0 days 21:21:08.351135000,76868.351135,1
2018-03-06 12:18:48,2018-03-07 02:22:07.351216,Woman in Russian spy mystery identified as Sergei Skripal's daughter,Plainchant,theguardian.com,337,0 days 14:03:19.351216000,50599.351216,1
2018-03-06 14:19:00,2018-03-07 02:22:07.351299,"Over half of young Venezuelans want to flee as economy collapses, poll finds",D2theCCNP,theguardian.com,292,0 days 12:03:07.351299000,43387.351299,1
2018-03-06 16:11:56,2018-03-07 02:22:07.351383,School bus driver arrested after posting threat to 'shoot up' middle school: Officials,javajen84,abcnews.go.com,265,0 days 10:10:11.351383000,36611.351383,1
2018-03-06 19:45:41,2018-03-07 02:22:07.351467,"Opioid crisis: overdoses increased by a third across US in 14 months, says CDC",GriffonsChainsaw,theguardian.com,261,0 days 06:36:26.351467000,23786.351467,1
2018-03-06 17:07:12,2018-03-07 02:22:07.351550,Uber booked half the theater for the opening night of a play inspired by the scandals that took down former CEO Travis Kalanick,BadDrvrsofSac,sfgate.com,243,0 days 09:14:55.351550000,33295.35155,1
2018-03-06 21:15:06,2018-03-07 02:22:07.351632,"Teen shot five times at Stoneman Douglas High plans to sue BSO, school system",eregular,miamiherald.com,227,0 days 05:07:01.351632000,18421.351632,1
2018-03-06 20:33:16,2018-03-07 02:22:07.351714,US Aircraft Carrier docks in Vietnam for the first time since Vietnam War,obadiah24,sofrep.com,202,0 days 05:48:51.351714000,20931.351714,1
2018-03-06 05:10:53,2018-03-07 02:22:07.351796,Oldest-known message in a bottle found on WA beach 132 years after being tossed overboard (Australia),LuckyBdx4,abc.net.au,187,0 days 21:11:14.351796000,76274.351796,1
2018-03-06 18:04:40,2018-03-07 02:22:07.351877,Uber’s self-driving trucks are now delivering cargo in Arizona,getBusyChild,theverge.com,151,0 days 08:17:27.351877000,29847.351877,1
2018-03-06 22:18:02,2018-03-07 02:22:07.351960,"Student who left explosives had posted ISIS propaganda, police say | KSL.com",samnester,ksl.com,152,0 days 04:04:05.351960000,14645.351960000002,1
2018-03-06 05:34:47,2018-03-07 02:22:07.352042,"Man convicted of kidnapping, raping and robbing pregnant woman gets life sentence",traunkss,nola.com,136,0 days 20:47:20.352042000,74840.352042,1
2018-03-06 02:54:58,2018-03-07 02:22:07.352125,Utah State Bar sends photo of topless woman to every lawyer in the state,javajen84,wtkr.com,131,0 days 23:27:09.352125000,84429.352125,1
2018-03-06 13:36:24,2018-03-07 02:22:07.352208,Stoneman Douglas shooting survivor lets Broward know he is ready to sue,Minscota,orlandosentinel.com,118,0 days 12:45:43.352208000,45943.352208000004,1
2018-03-06 09:53:59,2018-03-07 02:22:07.352290,"U.S. Army says mishandled war dogs, will comply with call for reform",ireallyloveflannel,reuters.com,106,0 days 16:28:08.352290000,59288.35229,1
2018-03-06 18:07:43,2018-03-07 02:22:07.352373,"SF mother, 7-year-old son found dead, buried under snow.",Amcal,abc7news.com,90,0 days 08:14:24.352373000,29664.352373,1
2018-03-06 04:35:10,2018-03-07 02:22:07.352456,"Anti-GMO articles tied to Russian sites, ISU research shows",pyrojoe121,amp.desmoinesregister.com,90,0 days 21:46:57.352456000,78417.35245600001,1
2018-03-06 23:47:12,2018-03-07 02:22:07.352538,"Fyre Festival’s Billy McFarland Pleads Guilty to Wire Fraud, Faces Up to 40 Years",ObviousTwist,pitchfork.com,103,0 days 02:34:55.352538000,9295.352538000001,1
2018-03-06 16:25:01,2018-03-07 02:22:07.352621,Mayor Megan Barry thanks Nashville as she resigns from office,Hades-Cerberus,wkrn.com,87,0 days 09:57:06.352621000,35826.352621000005,1
2018-03-06 21:51:08,2018-03-07 02:22:07.352703,Footage of San Francisco After 1906 Quake Found at Flea Market,GeoGeoGeoGeo,kqed.org,92,0 days 04:30:59.352703000,16259.352703,1
2018-03-06 19:39:10,2018-03-07 02:22:07.352785,Conspiracy Theorists Arrested in Sutherland Springs,soopninjas,ktsa.com,87,0 days 06:42:57.352785000,24177.352785000003,1
2018-03-06 08:36:46,2018-03-07 02:22:07.352871,North Korea's Kim Jong Un Wants to 'Write a New History' With South Korea After Talks,Quintiiin,time.com,81,0 days 17:45:21.352871000,63921.352871,1
2018-03-06 03:26:48,2018-03-07 02:22:07.352977,Woman restrained after trying to open airplane cabin door during flight,cookiesandmilk41790,cbsnews.com,84,0 days 22:55:19.352977000,82519.352977,1
2018-03-06 04:36:51,2018-03-07 02:22:07.353062,"Oregon man sues Dick's, Walmart over gun policies",tooth_soup,koin.com,67,0 days 21:45:16.353062000,78316.35306200001,1
2018-03-06 20:46:51,2018-03-07 02:22:07.353144,Maryland's highest court reinstates police officers' names to courts database,aresef,baltimoresun.com,68,0 days 05:35:16.353144000,20116.353144,1
2018-03-06 22:13:54,2018-03-07 02:22:07.353226,"Billy McFarland, organizer of disastrous Fyre Festival, pleads guilty to misleading investors",blainegoatbert,cnbc.com,71,0 days 04:08:13.353226000,14893.353226000001,1
2018-03-06 08:13:42,2018-03-07 02:22:07.353308,SpaceX Launches Spanish Communications Satellite on Landmark 50th Falcon 9 Flight,javajen84,space.com,55,0 days 18:08:25.353308000,65305.353308000005,1
2018-03-06 23:07:57,2018-03-07 02:22:07.353391,The weekend's bomb cyclone uncovered a centuries-old ship on a Maine beach,BadDrvrsofSac,cnn.com,57,0 days 03:14:10.353391000,11650.353391,1
2018-03-06 21:18:57,2018-03-07 02:22:07.353474,US closes naturalization offices at military basic training sites,AudibleNod,navytimes.com,57,0 days 05:03:10.353474000,18190.353474,1
2018-03-06 16:03:34,2018-03-07 02:22:07.353556,Grandmother arrested for bringing Doritos bag full of drugs into jail.,noiwontpickaname,fox13memphis.com,54,0 days 10:18:33.353556000,37113.353556,1
2018-03-07 00:17:01,2018-03-07 02:22:07.353640,Major cause of dementia discovered,cookiesandmilk41790,knowridge.com,70,0 days 02:05:06.353640000,7506.35364,1
2018-03-06 09:58:15,2018-03-07 02:22:07.353722,UK is world's largest producer of legal cannabis,howlingmagpie,news.sky.com,52,0 days 16:23:52.353722000,59032.35372200001,1
2018-03-06 09:30:47,2018-03-07 02:22:07.353804,"Raleigh girl, 13, was abducted, sexually assaulted, police say",cheifminecrafter,abc11.com,50,0 days 16:51:20.353804000,60680.353804000006,1
2018-03-06 17:13:25,2018-03-07 02:22:07.353888,"Japanese volcano erupts, dozens of flights grounded",AudibleNod,stripes.com,52,0 days 09:08:42.353888000,32922.353888000005,1
2018-03-06 13:46:33,2018-03-07 02:22:07.353972,Lego admits it made too many bricks,chefranden,bbc.com,48,0 days 12:35:34.353972000,45334.353972000004,1
2018-03-06 16:18:56,2018-03-07 02:22:07.354063,Perris torture case: Teen who escaped Turpin home posted videos under alias,Digital517,abc7.com,47,0 days 10:03:11.354063000,36191.354063,0
2018-03-06 20:12:31,2018-03-07 02:22:07.354162,School superintendent apologizes after girls’ high school basketball team wins playoff game by 86 points,foggydogg12345,boston.com,45,0 days 06:09:36.354162000,22176.354162,0
2018-03-06 15:36:16,2018-03-07 02:22:07.354246,Japan's navy appoints first woman to command warship squadron,veiledgossiper,reuters.com,41,0 days 10:45:51.354246000,38751.354246,0
2018-03-06 07:04:40,2018-03-07 02:22:07.354327,Police probe substance as Russian spy 'critical' in hospital,demonicmax56,bbc.com,47,0 days 19:17:27.354327000,69447.35432700001,0
2018-03-06 19:28:39,2018-03-07 02:22:07.354410,"BlackBerry files patent infringement suit against Facebook, Instagram, WhatsApp",oysterboy9,cbc.ca,40,0 days 06:53:28.354410000,24808.35441,0
2018-03-06 13:40:02,2018-03-07 02:22:07.354491,Sunoco pipeline drilling causes sinkholes to form in West Whiteland Township (PA),Turtle23206685,dailylocal.com,36,0 days 12:42:05.354491000,45725.354491000006,0
2018-03-06 09:09:18,2018-03-07 02:22:07.354574,Footage of ISIS ambushing U.S. Special Forces in Niger,intelusa,sofrep.com,37,0 days 17:12:49.354574000,61969.354574000005,0
2018-03-06 19:21:51,2018-03-07 02:22:07.354656,"Cosby wants to block accusers, but show settlement to jury",Plainchant,apnews.com,39,0 days 07:00:16.354656000,25216.354656000003,0
2018-03-06 14:17:45,2018-03-07 02:22:07.354738,Pair arrested after harassing pastor in Sutherland Springs,thebigpodowski,m.mysanantonio.com,31,0 days 12:04:22.354738000,43462.354738,0
2018-03-06 04:03:05,2018-03-07 02:22:07.354820,"Charges: Man crawled into woman's bathroom stall on Minneapolis Community and Technical College campus, attempted to sexually assault woman.",traunkss,fox9.com,34,0 days 22:19:02.354820000,80342.35482000001,0
2018-03-06 19:28:59,2018-03-07 02:22:07.354904,'No dancing': Saudi concert edict stirs ridicule,DirkPitt94,afp.com,37,0 days 06:53:08.354904000,24788.354904,0
2018-03-06 18:47:27,2018-03-07 02:22:07.354987,Officials in New Mexico town battling skunk invasion,travelbae,ajc.com,32,0 days 07:34:40.354987000,27280.354987000002,0
2018-03-06 21:50:16,2018-03-07 02:22:07.355069,"Wisconsin Doubles GPS Monitoring Despite 5 Years Of Malfunctions, Unnecessary Jailings",GriffonsChainsaw,wpr.org,32,0 days 04:31:51.355069000,16311.355069000001,0
2018-03-06 16:05:13,2018-03-07 02:22:07.355151,McDonald's is putting fresh beef in the Quarter Pounder,triplefastaction,money.cnn.com,29,0 days 10:16:54.355151000,37014.355151,0
2018-03-06 05:22:32,2018-03-07 02:22:07.355233,N.C. man accused of sexually assaulting four-year-old now faces 37 child sex charges,cookiesandmilk41790,cbsnews.com,26,0 days 20:59:35.355233000,75575.35523300001,0
2018-03-06 15:23:59,2018-03-07 02:22:07.355315,Putin says Russians accused of US election meddling could be prosecuted in Russia,D2theCCNP,cnbc.com,29,0 days 10:58:08.355315000,39488.355315,0
2018-03-06 03:36:22,2018-03-07 02:22:07.355397,Cigarette giant Philip Morris slashes Australian workforce,cookiesandmilk41790,theage.com.au,25,0 days 22:45:45.355397000,81945.355397,0
2018-03-06 06:08:27,2018-03-07 02:22:07.355479,Rapper admits having weapon before Little Rock club shooting that injured 25,discocrisco,cbsnews.com,28,0 days 20:13:40.355479000,72820.355479,0
2018-03-06 13:43:30,2018-03-07 02:22:07.355564,Chuck Feeney: the billionaire who gave it all away,jimmyolsenblues,irishtimes.com,24,0 days 12:38:37.355564000,45517.355564000005,0
2018-03-07 00:09:40,2018-03-07 02:22:07.355646,"Baltimore spending board to approve $200,000 for lawyers to fight deportations",traunkss,baltimoresun.com,28,0 days 02:12:27.355646000,7947.355646000001,0
2018-03-06 19:25:34,2018-03-07 02:22:07.355728,"Boyfriend's Tinder app triggers samurai sword attack in Camas, woman tells police",Valsetz,oregonlive.com,23,0 days 06:56:33.355728000,24993.355728000002,0
2018-03-06 15:11:34,2018-03-07 02:22:07.355810,Twickenham woman killed as family found dead on beach,zidan001,bbc.com,23,0 days 11:10:33.355810000,40233.35581,0
2018-03-06 04:12:24,2018-03-07 02:22:07.355891,"Fontana 21-Year-Old Sentenced 25 Years to Life in Murder, Robbery of His Ex-Girlfriend’s Dad",9magsz,ktla.com,22,0 days 22:09:43.355891000,79783.355891,0
2018-03-06 13:48:20,2018-03-07 02:22:07.355974,Russian plane crash in Syria 'kills 32',cousinz,bbc.co.uk,22,0 days 12:33:47.355974000,45227.355974000006,0
2018-03-06 12:45:19,2018-03-07 02:22:07.356056,Russian spy mystery: CCTV emerges of two people police are looking for – video,klynstra,theguardian.com,22,0 days 13:36:48.356056000,49008.356056000004,0
2018-03-06 13:12:18,2018-03-07 02:22:07.356139,Environmental racism case: EPA rejects Alabama town's claim over toxic landfill,ohnoitsboilingacid,theguardian.com,21,0 days 13:09:49.356139000,47389.356139,0
2018-03-06 23:09:47,2018-03-07 02:22:07.356221,Vandalism mob linked to anarchist book fair that occurred same weekend: police,call_the_whambulance,cp24.com,19,0 days 03:12:20.356221000,11540.356221,0
2018-03-06 21:09:16,2018-03-07 02:22:07.356302,Electric Shock Delivered at Trial to Texas Defendant Results in Reversal of Pedophile Conviction,recipriversexcluson,law.com,19,0 days 05:12:51.356302000,18771.356302,0
2018-03-06 20:28:38,2018-03-07 02:22:07.356384,Gun background checks jumped in February,MilmoWK,jsonline.com,19,0 days 05:53:29.356384000,21209.356384000002,0
2018-03-06 15:32:39,2018-03-07 02:22:07.356466,Mayor Barry to appear in court on Tuesday morning,zim555,wsmv.com,17,0 days 10:49:28.356466000,38968.356466000005,0
2018-03-06 08:36:31,2018-03-07 02:22:07.356548,Probe finds deadly Niger mission lacked proper approval,Consiliarius,apnews.com,18,0 days 17:45:36.356548000,63936.356548,0
2018-03-07 00:33:38,2018-03-07 02:22:07.356630,Students threatened with detention for participation in walkout over gun control,Boo_Wendy_Boo,abc7chicago.com,20,0 days 01:48:29.356630000,6509.35663,0
2018-03-07 00:11:13,2018-03-07 02:22:07.356711,Father Forces Son To Run To School In The Rain For Bullying,crumbbelly,lex18.com,19,0 days 02:10:54.356711000,7854.356711,0
2018-03-06 22:28:55,2018-03-07 02:22:07.356792,"Fyre Festival Promoter Pleads Guilty, Won't Appeal 8- to 10-Year Sentence",oysterboy9,pollstar.com,17,0 days 03:53:12.356792000,13992.356792,0
2018-03-06 23:22:26,2018-03-07 02:22:07.356873,"Kobe Steel admits data fraud went on nearly five decades, CEO to quit",Henry_Avery,reuters.com,19,0 days 02:59:41.356873000,10781.356873,0
2018-03-06 08:47:15,2018-03-07 02:22:07.356954,Woman arrested after five stabbed on California-bound Greyhound bus: police,ireallyloveflannel,foxnews.com,17,0 days 17:34:52.356954000,63292.356954,0
2018-03-07 01:50:44,2018-03-07 02:22:07.357035,"Mississippi town to allow gay pride parade, reversing denial",dangerouslesbian,apnews.com,39,0 days 00:31:23.357035000,1883.3570350000002,0
2018-03-06 22:49:11,2018-03-07 02:22:07.357116,Linda Sarsour arrested at Paul Ryan's office,imrepairmanman,aljazeera.com,17,0 days 03:32:56.357116000,12776.357116000001,0
2018-03-06 22:47:04,2018-03-07 02:22:07.357198,Mega-donors who pledged $100 million to University of Chicago sue to get money back,Throwaway0um3455,usatoday.com,14,0 days 03:35:03.357198000,12903.357198000002,0
2018-03-06 16:56:34,2018-03-07 02:22:07.357279,Ex-Sarasota physician defrauds man with false cancer diagnosis,soopninjas,tbo.com,10,0 days 09:25:33.357279000,33933.357279,0
2018-03-06 15:27:55,2018-03-07 02:22:07.357361,Russia and U.S. air strikes caused mass civilian deaths in Syria: U.N.,dont_tread_on_dc,reuters.com,11,0 days 10:54:12.357361000,39252.357361,0
2018-03-07 00:20:23,2018-03-07 02:22:07.357443,Man who forced couples into sex at gunpoint convicted of 60 crimes,9magsz,nj.com,16,0 days 02:01:44.357443000,7304.357443000001,0
2018-03-07 00:15:02,2018-03-07 02:22:07.357524,Investor group cancels deal to buy Weinstein Co.,welcometonutbush,apnews.com,17,0 days 02:07:05.357524000,7625.357524000001,0
2018-03-07 00:27:40,2018-03-07 02:22:07.357605,Texas primary results — live updates,cookiesandmilk41790,cbsnews.com,24,0 days 01:54:27.357605000,6867.357605,0
2018-03-06 22:52:26,2018-03-07 02:22:07.357687,No police search at home of man who shot self by White House,javajen84,apnews.com,14,0 days 03:29:41.357687000,12581.357687000002,0
2018-03-06 10:48:03,2018-03-07 02:22:07.357776,Austintown OH student found with box-cutter in school tells his story,PaleBlueDot9,wfmj.com,13,0 days 15:34:04.357776000,56044.357776000004,0
2018-03-06 03:06:19,2018-03-07 02:22:07.357859,Suspect Takes Stand In Murder Trial Of Transgender Woman In 2013,GriffonsChainsaw,philadelphia.cbslocal.com,10,0 days 23:15:48.357859000,83748.35785900001,0
2018-03-07 00:04:43,2018-03-07 02:22:07.357942,Thousands of dead starfish wash up on UK beaches,cookiesandmilk41790,cnn.com,17,0 days 02:17:24.357942000,8244.357942,0
2018-03-06 04:51:21,2018-03-07 02:22:07.358025,Merriam-Webster Adds 850 new words and definitions,doug3465,merriam-webster.com,10,0 days 21:30:46.358025000,77446.35802500001,0
2018-03-06 17:34:12,2018-03-07 02:22:07.358124,Elon Musk fans targeted in crypto-cash scam,zim555,bbc.com,9,0 days 08:47:55.358124000,31675.358124000002,0
2018-03-06 08:15:32,2018-03-07 02:22:07.358209,Apple reseller in Malaysia forced to cancel $50 iPhone sale when thousands of people showed up,AgentWhisky,m.gsmarena.com,8,0 days 18:06:35.358209000,65195.358209000005,0
