created_utc,scraped_utc,title,author,domain,upvotes,up_time,up_seconds,target
2018-03-09 18:57:30,2018-03-09 22:39:32.072068,'Pharma bro' Martin Shkreli sentenced to 7 years in prison,BabyJesusFTW,cnbc.com,56773,0 days 03:42:02.072068000,13322.072068000001,1
2018-03-09 10:36:28,2018-03-09 22:39:32.086548,"North Carolina police officer resigns after beating, choking and tasing suspected jaywalker",welcometonutbush,cnn.com,42429,0 days 12:03:04.086548000,43384.086548,1
2018-03-08 22:36:49,2018-03-09 22:39:32.086672,Comcast Found ‘Accidentally’ Blocking Legitimate Sites — Including PayPal and Steam,GrandmaDoggies,digitalmusicnews.com,40617,1 days 00:02:43.086672000,86563.086672,1
2018-03-09 00:36:37,2018-03-09 22:39:32.086773,"Kim Jong-un and Donald Trump to meet, says South Korea",headtailgrep,cbc.ca,26366,0 days 22:02:55.086773000,79375.086773,1
2018-03-08 22:54:44,2018-03-09 22:39:32.086867,Loaded gun falls out of Florida kindergartner’s backpack in class,cookiesandmilk41790,ctvnews.ca,2139,0 days 23:44:48.086867000,85488.086867,1
2018-03-09 14:15:29,2018-03-09 22:39:32.086957,A sheriff's deputy had his ex-wife arrested because he didn't like what she wrote about him on Facebook,Khaleeasi24,cnn.com,2101,0 days 08:24:03.086957000,30243.086957000003,1
2018-03-09 16:22:54,2018-03-09 22:39:32.087045,Credit card debt surpasses $1 trillion in the US for first time,thinkB4WeSpeak,abcnews.go.com,1208,0 days 06:16:38.087045000,22598.087045,1
2018-03-09 04:10:52,2018-03-09 22:39:32.087131,"School board sued over meeting where teacher removed, cuffed",chicksdigmonkeys,apnews.com,1073,0 days 18:28:40.087131000,66520.08713100001,1
2018-03-08 23:11:04,2018-03-09 22:39:32.087219,Drug charges dropped after suspect refuses to poop for 47 days in custody,quick711,foxnews.com,995,0 days 23:28:28.087219000,84508.08721900001,1
2018-03-09 11:37:43,2018-03-09 22:39:32.087305,A Bag Containing 54 Severed Human Hands Has Been Found in Eastern Russia,NovaStubble,time.com,1027,0 days 11:01:49.087305000,39709.087305,1
2018-03-08 23:33:01,2018-03-09 22:39:32.087390,"Toys R Us is preparing to liquidate its U.S. operations, sources say",FowelBallz,latimes.com,649,0 days 23:06:31.087390000,83191.08739,1
2018-03-09 14:01:32,2018-03-09 22:39:32.087475,Half of all F-35s delivered by Lockheed Martin are non-operational as negotiation continues on new contract,expletivdeleted,sofrep.com,606,0 days 08:38:00.087475000,31080.087475,1
2018-03-09 10:51:36,2018-03-09 22:39:32.087558,California bill would extend bar closing time to 4am,cookiesandmilk41790,abc7.com,535,0 days 11:47:56.087558000,42476.087558,1
2018-03-09 11:49:54,2018-03-09 22:39:32.087642,Toxic chemicals found in drinking water of 2 Detroit suburbs,PatienceAlice,mlive.com,509,0 days 10:49:38.087642000,38978.087642000006,1
2018-03-08 23:49:08,2018-03-09 22:39:32.087725,Oral sex is causing an oral cancer epidemic in men by outwitting natural defenses,Amcal,sacbee.com,406,0 days 22:50:24.087725000,82224.087725,1
2018-03-09 17:03:09,2018-03-09 22:39:32.087810,"Student accidentally shoots self at Lexington, Kentucky high school",chicksdigmonkeys,cbsnews.com,423,0 days 05:36:23.087810000,20183.08781,1
2018-03-09 03:46:05,2018-03-09 22:39:32.087895,Medic who documented Nazi camp horror dies at 93,cookiesandmilk41790,cnn.com,345,0 days 18:53:27.087895000,68007.087895,1
2018-03-09 12:16:51,2018-03-09 22:39:32.087981,"Mom makes kids walk 7 km, carrying sign saying they were rude to bus driver",headtailgrep,cbc.ca,341,0 days 10:22:41.087981000,37361.087981000004,1
2018-03-08 22:52:24,2018-03-09 22:39:32.088066,Mississippi passes law banning abortion after 15 weeks,cookiesandmilk41790,nbcnews.com,311,0 days 23:47:08.088066000,85628.08806600001,1
2018-03-09 05:04:23,2018-03-09 22:39:32.088151,Report to Kris Kobach shows 5 illegal voters out of 1.3 million ballots,hurtsdonut_,cjonline.com,309,0 days 17:35:09.088151000,63309.088151,1
2018-03-09 04:31:16,2018-03-09 22:39:32.088236,Police officer involved in high-speed collision sues mother of boy killed in crash,chicksdigmonkeys,abcnews.go.com,310,0 days 18:08:16.088236000,65296.088236,1
2018-03-09 13:41:10,2018-03-09 22:39:32.088321,Never-Before-Seen Mineral Found Inside a 'Super Deep' Diamond,eggn00dles,news.nationalgeographic.com,308,0 days 08:58:22.088321000,32302.088321000003,1
2018-03-09 18:35:29,2018-03-09 22:39:32.088404,"'Schools will stay closed until we get what we are asking for,' Oklahoma teachers union president says",spartan2600,tulsaworld.com,350,0 days 04:04:03.088404000,14643.088404,1
2018-03-09 14:08:12,2018-03-09 22:39:32.088489,World's last male northern white rhino on the mend after infection threatened the species,ga-vu,abc.net.au,261,0 days 08:31:20.088489000,30680.088489,1
2018-03-09 14:46:31,2018-03-09 22:39:32.088573,US job growth surges in February,hammuhshloggin88,bbc.com,164,0 days 07:53:01.088573000,28381.088573,1
2018-03-09 14:07:43,2018-03-09 22:39:32.088656,"Senate leader says $10,000 pay raise raise for teachers 'very unrealistic'",rubbar,tulsaworld.com,138,0 days 08:31:49.088656000,30709.088656000004,1
2018-03-09 17:56:48,2018-03-09 22:39:32.088740,Bay Area coffee shop won't serve police for 'safety of customers',rjohnstone13,m.sfgate.com,142,0 days 04:42:44.088740000,16964.088740000003,1
2018-03-09 18:23:34,2018-03-09 22:39:32.088825,ACLU files class-action lawsuit against US for separating immigrant families,beelzeflub,apnews.com,112,0 days 04:15:58.088825000,15358.088825,1
2018-03-08 23:08:58,2018-03-09 22:39:32.088907,Right-wing activists target Berkeley's Revolution Books again,VocaMae,berkeleyside.com,107,0 days 23:30:34.088907000,84634.08890700001,1
2018-03-09 02:39:40,2018-03-09 22:39:32.088990,"Asheville, NC, cop charged and arrested",treykindlinger,citizen-times.com,98,0 days 19:59:52.088990000,71992.08899,1
2018-03-09 19:17:54,2018-03-09 22:39:32.089073,Yountville Veteran's Home Under Lockdown After Shots Fired,datank56,nbcbayarea.com,143,0 days 03:21:38.089073000,12098.089073000001,1
2018-03-08 23:57:11,2018-03-09 22:39:32.089156,"She ran over her ‘sugar daddy’ when he got tired of buying her things, Georgia DA says",Kaylabel,kansascity.com,95,0 days 22:42:21.089156000,81741.089156,1
2018-03-09 04:26:32,2018-03-09 22:39:32.089240,"Interior department spending $139,000 on Sec. Ryan Zinke's doors",filterface,apnews.com,82,0 days 18:13:00.089240000,65580.08924,1
2018-03-09 17:57:33,2018-03-09 22:39:32.089324,Man dies after driving around barricade and onto live wires in New Jersey,WelcomeToRonsMexico,abc13.com,92,0 days 04:41:59.089324000,16919.089324,1
2018-03-09 01:49:51,2018-03-09 22:39:32.089407,Women in Syria 'forced to exchange sexual favours' for UN aid,salawm,telegraph.co.uk,76,0 days 20:49:41.089407000,74981.089407,1
2018-03-09 02:14:35,2018-03-09 22:39:32.089491,Seattle police first in state to seize gun under mental health law,nixt26,komonews.com,71,0 days 20:24:57.089491000,73497.089491,1
2018-03-09 13:19:37,2018-03-09 22:39:32.089576,"Priest followed 2 sex abuse victims from North Tonawanda to Atlanta, mother says",pollyjunki,buffalonews.com,67,0 days 09:19:55.089576000,33595.089576,1
2018-03-09 00:47:32,2018-03-09 22:39:32.089661,"Remains found in wooded area identified as Christina Morris, missing since 2014",cookiesandmilk41790,nbcnews.com,65,0 days 21:52:00.089661000,78720.089661,1
2018-03-09 19:26:01,2018-03-09 22:39:32.089746,‘Your Word Against Mine’: College Baseball Coach Accused of Raping Teen Players,stumblybumble,thedailybeast.com,78,0 days 03:13:31.089746000,11611.089746000001,1
2018-03-09 13:49:17,2018-03-09 22:39:32.089831,South Korean actor Jo Min-ki found dead after sexual assault accusations,Plainchant,theguardian.com,59,0 days 08:50:15.089831000,31815.089831,1
2018-03-08 23:12:24,2018-03-09 22:39:32.089931,"USS John S McCain collision in Singapore waters due to 'sudden turn' by US warship, says MOT",MyWholeTeamsDead,channelnewsasia.com,52,0 days 23:27:08.089931000,84428.08993100001,1
2018-03-09 13:48:17,2018-03-09 22:39:32.090019,New information reveals six officers initially overlooked body found in van on MPD impound lot after 49 days,stankmanly,wreg.com,56,0 days 08:51:15.090019000,31875.090019000003,1
2018-03-09 17:38:20,2018-03-09 22:39:32.090103,US soldier found dead at Army base in South Korea,PittStateGuerilla,abcnews.go.com,58,0 days 05:01:12.090103000,18072.090103000002,1
2018-03-09 15:00:19,2018-03-09 22:39:32.090187,"A 9-Month-Old Died After Eating Heroin and Fentanyl, Police Say",Bman409,time.com,54,0 days 07:39:13.090187000,27553.090187,1
2018-03-09 10:37:08,2018-03-09 22:39:32.090271,Cryptocurrency exchange hack thwarted as thieves lose their own money in failed robbery,Danyo-,independent.co.uk,53,0 days 12:02:24.090271000,43344.090271,1
2018-03-09 20:02:09,2018-03-09 22:39:32.090356,"Stoneman Douglas' resource officer radioed about gunfire in 1200 building but didn't go inside, calls reveal",be_completely_honest,cnn.com,74,0 days 02:37:23.090356000,9443.090356,1
2018-03-09 07:20:38,2018-03-09 22:39:32.090440,Scientist still not sure where Chinese space station will crash to Earth,bobhazor,theguardian.com,44,0 days 15:18:54.090440000,55134.09044,0
2018-03-08 23:09:23,2018-03-09 22:39:32.090525,Applebee's customers who used credit cards subject to data breach,jjboggs,kgun9.com,45,0 days 23:30:09.090525000,84609.090525,1
2018-03-09 21:10:21,2018-03-09 22:39:32.090611,"Police descend on Napa County veterans home after gunman opens fire, takes hostages",cheifminecrafter,mercurynews.com,74,0 days 01:29:11.090611000,5351.0906110000005,1
2018-03-09 11:41:11,2018-03-09 22:39:32.090697,UK - 180 Military personnel deployed in Salisbury to aid Russian spy case,I_SHAG_REDHEADS,bbc.co.uk,43,0 days 10:58:21.090697000,39501.090697,0
2018-03-09 03:47:36,2018-03-09 22:39:32.090782,"Mysterious burst of light, loud boom puzzles Washington state residents",cookiesandmilk41790,abcnews.go.com,44,0 days 18:51:56.090782000,67916.090782,0
2018-03-09 04:39:24,2018-03-09 22:39:32.090865,"Ryan Bundy, who led two armed standoffs against federal agents, says he'll run for Nevada governor",josefmyth,sltrib.com,46,0 days 18:00:08.090865000,64808.090865000006,1
2018-03-09 00:10:46,2018-03-09 22:39:32.090948,Indiana man charged in beating deaths of 2 stolen dogs,jebotionmater,apnews.com,44,0 days 22:28:46.090948000,80926.09094800001,0
2018-03-09 00:02:07,2018-03-09 22:39:32.091031,CMU shooter James Davis had fled hospital hours before allegedly killing parents,craponapoopstick,mlive.com,44,0 days 22:37:25.091031000,81445.091031,0
2018-03-09 06:38:33,2018-03-09 22:39:32.091114,Abercrombie & Fitch to close 60 more stores,thinkB4WeSpeak,cnbc.com,38,0 days 16:00:59.091114000,57659.091114,0
2018-03-09 13:04:27,2018-03-09 22:39:32.091197,100-year-old San Diego woman reveals her secret to a long life: beer and many potato chips every single day,SnowyHawaiian,kmov.com,40,0 days 09:35:05.091197000,34505.091197,0
2018-03-09 12:36:08,2018-03-09 22:39:32.091281,"Her dad wanted to end child support, so she helped stage her mom’s death, NY cops say",Kaylabel,miamiherald.com,37,0 days 10:03:24.091281000,36204.091281,0
2018-03-09 16:26:23,2018-03-09 22:39:32.091365,"Nasdaq hits record high, Dow surges more than 250 points after strong jobs report",Jim631,cnbc.com,40,0 days 06:13:09.091365000,22389.091365,0
2018-03-09 19:32:44,2018-03-09 22:39:32.091450,Book lover reads aloud on crowded bus for two stops to annoy man who called her a 'fucking bitch',Danyo-,standard.co.uk,38,0 days 03:06:48.091450000,11208.09145,0
2018-03-09 06:43:37,2018-03-09 22:39:32.091534,The Volkswagen Beetle will soon be squashed,javajen84,foxnews.com,29,0 days 15:55:55.091534000,57355.09153400001,0
2018-03-09 02:43:27,2018-03-09 22:39:32.091618,Missouri turkey farm quarantined after bird flu detected,dangerouslesbian,apnews.com,32,0 days 19:56:05.091618000,71765.091618,0
2018-03-09 00:16:41,2018-03-09 22:39:32.091701,Child sexual abuse inquiry considers Jehovah's Witnesses UK investigation,Alex09464367,theguardian.com,37,0 days 22:22:51.091701000,80571.09170100001,0
2018-03-09 18:21:04,2018-03-09 22:39:32.091785,'There is hope': former homeless woman serves as valedictorian for graduating class,headtailgrep,cbc.ca,37,0 days 04:18:28.091785000,15508.091785,0
2018-03-09 05:17:43,2018-03-09 22:39:32.091869,Russian spy attack inquiry widens after medics treat 21 people,Plainchant,theguardian.com,27,0 days 17:21:49.091869000,62509.091869,0
2018-03-09 02:59:00,2018-03-09 22:39:32.091952,Malfunction at egg freezing facility affects hundreds of patients,dangerouslesbian,nbcnews.com,25,0 days 19:40:32.091952000,70832.091952,0
2018-03-09 17:08:56,2018-03-09 22:39:32.092036,"Airline bans employees from 'manterrupting,' saying 'mum' or 'dad'",Beercorn1,chron.com,28,0 days 05:30:36.092036000,19836.092036000002,0
2018-03-09 03:17:10,2018-03-09 22:39:32.092121,San Antonio FD working to remove teenager trapped for hours 350 feet inside Alamo Heights cave,krozarEQ,mysanantonio.com,23,0 days 19:22:22.092121000,69742.09212100001,0
2018-03-09 21:04:24,2018-03-09 22:39:32.092205,Twitter CEO Hints at Verification-for-All in Bid to Combat Bots,cookiesandmilk41790,thedailybeast.com,48,0 days 01:35:08.092205000,5708.092205,1
2018-03-09 02:35:13,2018-03-09 22:39:32.092289,Daughter of man suspected of strangling wife admits distracting sibling during murder,welcometonutbush,cbsnews.com,22,0 days 20:04:19.092289000,72259.09228900001,0
2018-03-09 21:01:45,2018-03-09 22:39:32.092374,Journalist who died on submarine texted 'I'm still alive' day she disappeared,Digital517,abc7.com,38,0 days 01:37:47.092374000,5867.092374000001,0
2018-03-09 17:24:37,2018-03-09 22:39:32.092458,Burger-flipping robot taken offline after one day,JennJayBee,bbc.com,22,0 days 05:14:55.092458000,18895.092458000003,0
2018-03-09 15:23:38,2018-03-09 22:39:32.092542,Obamas 'in talks to make Netflix shows',esporx,bbc.com,19,0 days 07:15:54.092542000,26154.092542000002,0
2018-03-09 12:27:34,2018-03-09 22:39:32.092625,Suicide bomber kills 9 in Kabul; Taliban kill 16 in province,affairsofmydick,apnews.com,19,0 days 10:11:58.092625000,36718.092625000005,0
2018-03-09 04:15:13,2018-03-09 22:39:32.092710,"Roommate allegedly snaps, chokes 92-year-old SoHo woman because of her snoring: source",oshiyay,pix11.com,22,0 days 18:24:19.092710000,66259.09271,0
2018-03-09 20:15:11,2018-03-09 22:39:32.092795,US hiring surge last month pulls in flood of new workers,nilnz,apnews.com,24,0 days 02:24:21.092795000,8661.092795,0
2018-03-09 19:19:41,2018-03-09 22:39:32.092879,"Iowa grocers participating in a supplemental food program would need to offer conventional eggs if they sell eggs from chickens housed in a cage-free, free-range or enriched colony cage environment under an Iowa House bill passed Monday night.",vacuousaptitude,desmoinesregister.com,25,0 days 03:19:51.092879000,11991.092879000002,0
2018-03-09 17:29:16,2018-03-09 22:39:32.092963,MIT and newly formed company launch novel approach to fusion power,AlexXD19,news.mit.edu,22,0 days 05:10:16.092963000,18616.092963000003,0
2018-03-09 16:24:18,2018-03-09 22:39:32.093047,"2,000 frozen eggs and embryos possibly ‘compromised’ after fertility clinic temperature malfunction",stereomatch,washingtonpost.com,19,0 days 06:15:14.093047000,22514.093047000002,0
2018-03-08 22:47:38,2018-03-09 22:39:32.093131,Gay pastor to stand 'trial' for marriage to man,PhatWalda,theindychannel.com,21,0 days 23:51:54.093131000,85914.093131,0
2018-03-09 07:37:01,2018-03-09 22:39:32.093216,"A dispute between Serbia and Kosovo has disrupted the electric power grid for most of Europe, making certain kinds of clocks — many of those on ovens, in heating systems and on radios — run up to six minutes slow",RampantInanity,nytimes.com,18,0 days 15:02:31.093216000,54151.093216,0
2018-03-09 03:43:57,2018-03-09 22:39:32.093300,US drone targeting Pakistani Taliban kills 21 in Afghanistan,Comey-is-my-Homey,navytimes.com,20,0 days 18:55:35.093300000,68135.09330000001,0
2018-03-09 16:13:03,2018-03-09 22:39:32.093384,Spacecraft with nuke could save us from asteroids,bobhazor,space.com,16,0 days 06:26:29.093384000,23189.093384,0
2018-03-09 19:11:30,2018-03-09 22:39:32.093467,*Hartford Police Say Man Drove Stolen Car to Court To Face Stolen Car Charge*,URallABunchOfCucks,courant.com,20,0 days 03:28:02.093467000,12482.093467,0
2018-03-09 04:28:07,2018-03-09 22:39:32.093551,Sheriff accuses banned immigrant rights group of sneaking ‘contraband’ to ICE detainees,traunkss,mercurynews.com,17,0 days 18:11:25.093551000,65485.093551000005,0
2018-03-09 05:19:31,2018-03-09 22:39:32.093634,"Center City Rape Suspect Arrested Near Scene of the Crime, Philadelphia Police Said, Second Man Sought",9magsz,nbcphiladelphia.com,15,0 days 17:20:01.093634000,62401.093634000004,0
2018-03-09 21:25:11,2018-03-09 22:39:32.093718,Standoff continues at Veterans Home in Yountville as man with gun holds hostages,Dpizzle688,napavalleyregister.com,20,0 days 01:14:21.093718000,4461.093718,0
2018-03-08 22:58:05,2018-03-09 22:39:32.093802,Scientists develop pigs for transplants,KermitMadMan,the-japan-news.com,16,0 days 23:41:27.093802000,85287.093802,0
2018-03-09 06:51:42,2018-03-09 22:39:32.093886,Passive Euthanasia Approved By Indian Supreme Court,321tanmay,m.hindustantimes.com,14,0 days 15:47:50.093886000,56870.093886,0
2018-03-09 04:31:01,2018-03-09 22:39:32.093981,Three teens charged in carjacking of St. Ignatius High School student,9magsz,cleveland.com,15,0 days 18:08:31.093981000,65311.093981000005,0
2018-03-09 19:24:38,2018-03-09 22:39:32.094066,Huge explosion rocks military base in southwestern Iran,rubberbandrocks,xinhuanet.com,14,0 days 03:14:54.094066000,11694.094066000001,0
2018-03-09 15:07:24,2018-03-09 22:39:32.094150,"Springfield police sergeant accused of making inappropriate Facebook comments, calling critics ‘idiots’",davidverner,registerguard.com,14,0 days 07:32:08.094150000,27128.09415,0
2018-03-09 05:07:59,2018-03-09 22:39:32.094233,"In Nanny Trial, Jurors See Photos of ‘the Most Horrendous Scene’",traunkss,nytimes.com,12,0 days 17:31:33.094233000,63093.094233,0
2018-03-09 04:22:20,2018-03-09 22:39:32.094316,"US closes consular agency in Playa del Carmen, bars employees from travel over 'security threat'",skcku,abcnews.go.com,12,0 days 18:17:12.094316000,65832.094316,0
2018-03-09 02:43:45,2018-03-09 22:39:32.094405,The world’s first flying car you can buy is now taking orders,cookiesandmilk41790,cnbc.com,14,0 days 19:55:47.094405000,71747.09440500001,0
2018-03-09 21:02:08,2018-03-09 22:39:32.094491,Florida Gov. Rick Scott signs gun bill,DingDongInDaPingPong,cnn.com,20,0 days 01:37:24.094491000,5844.094491000001,0
2018-03-09 20:27:24,2018-03-09 22:39:32.094575,Report says radioactive monitors failed at nuclear plant. Mistakes and mismanagement are to blame for the exposure of workers to radioactive particles at the Hanford Nuclear Reservation in Washington state.,nilnz,apnews.com,13,0 days 02:12:08.094575000,7928.094575,0
2018-03-09 20:05:11,2018-03-09 22:39:32.094659,McDonald Observatory to Train National Park Service in Skywatching Programs for Visitors,clayt6,astronomy.com,12,0 days 02:34:21.094659000,9261.094659,0
2018-03-09 17:26:06,2018-03-09 22:39:32.094742,Police: video shows mom encouraging daughter to beat up another girl,Kaylabel,wpsdlocal6.com,14,0 days 05:13:26.094742000,18806.094742,0
2018-03-09 16:00:08,2018-03-09 22:39:32.094825,Hecla miners reject arbitration; opt to continue year-long strike,thinkB4WeSpeak,kxly.com,11,0 days 06:39:24.094825000,23964.094825,0
2018-03-09 14:42:45,2018-03-09 22:39:32.094908,Ex-police chief hints poison was in spy's home,neuhmz,sfgate.com,12,0 days 07:56:47.094908000,28607.094908000003,0
