created_utc,scraped_utc,title,author,domain,upvotes,up_time,up_seconds,target
2018-03-08 15:06:04,2018-03-09 04:00:30.736427,"Oklahoma Teachers union demands $10K raises, increased funding for education, state agencies",Dralas64,ktul.com,38937,0 days 12:54:26.736427000,46466.736427,1
2018-03-08 08:31:42,2018-03-09 04:00:30.759361,"New Jersey company will pay man's drunken $1,600 Uber fare - thanking him for choosing not to drink and drive.",TwisterWTF,fox5atlanta.com,36329,0 days 19:28:48.759361000,70128.759361,1
2018-03-08 22:36:49,2018-03-09 04:00:30.759569,Comcast Found ‘Accidentally’ Blocking Legitimate Sites — Including PayPal and Steam,GrandmaDoggies,digitalmusicnews.com,15871,0 days 05:23:41.759569000,19421.759569,1
2018-03-08 13:29:35,2018-03-09 04:00:30.759709,"Texas Judge Tortured Defendant With Stun Belt to Show ‘Power,’ Court Rules",stumblybumble,thedailybeast.com,4150,0 days 14:30:55.759709000,52255.759709000005,1
2018-03-08 18:00:28,2018-03-09 04:00:30.759836,"Former Marine drove into shop he thought was owned by Muslims to 'make them pay,' Louisiana cops say",_OldBay,miamiherald.com,3617,0 days 10:00:02.759836000,36002.759836000005,1
2018-03-08 10:32:22,2018-03-09 04:00:30.759963,"Over 500 Canadian doctors protest raises, say they're being paid too much (yes, too much)",dangerouslesbian,cnbc.com,3120,0 days 17:28:08.759963000,62888.759963000004,1
2018-03-08 13:16:07,2018-03-09 04:00:30.760084,Outrage Over Footage of Police Officer Beating a Black Man in North Carolina,dandmcd,nytimes.com,1906,0 days 14:44:23.760084000,53063.760084,1
2018-03-08 03:19:55,2018-03-09 04:00:30.760205,College professor who told Asian-Americans to 'go back to your country' is now on leave,karmatiger,kansascity.com,1413,1 days 00:40:35.760205000,88835.760205,1
2018-03-09 00:36:37,2018-03-09 04:00:30.760325,"Kim Jong-un and Donald Trump to meet, says South Korea",headtailgrep,cbc.ca,1779,0 days 03:23:53.760325000,12233.760325000001,1
2018-03-08 16:26:17,2018-03-09 04:00:30.760445,Ex-Russian Spy ‘Stable’ After Nerve Agent Attack in U.K.,chickenbobusos,nytimes.com,1035,0 days 11:34:13.760445000,41653.760445,1
2018-03-08 21:23:02,2018-03-09 04:00:30.760565,"Staffers Raped Teen Boys at Juvenile Detention Center, Lawsuit Claims",stumblybumble,thedailybeast.com,739,0 days 06:37:28.760565000,23848.760565,1
2018-03-08 14:42:48,2018-03-09 04:00:30.760681,Yale Student Found Not Guilty in Rape Trial,fatcat111,nytimes.com,647,0 days 13:17:42.760681000,47862.760681,1
2018-03-08 19:21:27,2018-03-09 04:00:30.760796,"State police try to control when news is reported. ‘That’s crazy,’ newspaper responds.",wildcat1977,kentucky.com,663,0 days 08:39:03.760796000,31143.760796000002,1
2018-03-08 15:49:43,2018-03-09 04:00:30.760912,Heather Locklear home raided after she threatens to shoot cops,mlauzon,tribute.ca,609,0 days 12:10:47.760912000,43847.760912000005,1
2018-03-08 22:54:44,2018-03-09 04:00:30.761028,Loaded gun falls out of Florida kindergartner’s backpack in class,cookiesandmilk41790,ctvnews.ca,494,0 days 05:05:46.761028000,18346.761028,1
2018-03-08 16:19:01,2018-03-09 04:00:30.761143,"Cop who allegedly groped, pursued female motorist to receive oral counseling: report",cookiesandmilk41790,foxnews.com,394,0 days 11:41:29.761143000,42089.761143,1
2018-03-08 20:50:46,2018-03-09 04:00:30.761261,Since 1988 it's been 100% legal to grope a strangers butt in Minnesota,Blingin,southernminn.com,398,0 days 07:09:44.761261000,25784.761261000003,1
2018-03-08 20:54:56,2018-03-09 04:00:30.761379,"Home Depot pledges $50 million to train 20,000 skilled laborers, military veterans wanted",cookiesandmilk41790,foxbusiness.com,386,0 days 07:05:34.761379000,25534.761379000003,1
2018-03-08 13:16:43,2018-03-09 04:00:30.761496,Uncontrolled Chinese space station Tiangong-1 will crash into Earth within weeks,TheLamestUsername,sciexaminer.com,322,0 days 14:43:47.761496000,53027.76149600001,1
2018-03-08 15:33:15,2018-03-09 04:00:30.761612,"Inmate offered $15K, sports car for hitman to kill victim in child molestation case, cops say",Kaylabel,orlandosentinel.com,332,0 days 12:27:15.761612000,44835.761612,1
2018-03-08 15:05:07,2018-03-09 04:00:30.761727,FBI has opened official investigation into Asheville police beating,Forest_of_Mirrors,citizen-times.com,269,0 days 12:55:23.761727000,46523.761727000005,1
2018-03-08 14:05:28,2018-03-09 04:00:30.761842,This Florida Warehouse Is Producing 'Made in America' Kalashnikovs,Bemuzed,bloomberg.com,245,0 days 13:55:02.761842000,50102.761842,1
2018-03-08 23:11:04,2018-03-09 04:00:30.761958,Drug charges dropped after suspect refuses to poop for 47 days in custody,quick711,foxnews.com,271,0 days 04:49:26.761958000,17366.761958000003,1
2018-03-08 13:56:42,2018-03-09 04:00:30.762075,U.S. Doctors Who Cut Open Seal Created by Female Genital Mutilation In Pregnant Refugees Then Resew and Close the Opening After Birth May Be at Legal Risk,DocBranhattan,tennesseestar.com,187,0 days 14:03:48.762075000,50628.762075000006,1
2018-03-08 21:40:58,2018-03-09 04:00:30.762191,ATF investigating after congressional candidate cut apart AR-15,neuhmz,wfmynews2.com,190,0 days 06:19:32.762191000,22772.762191,1
2018-03-08 20:10:28,2018-03-09 04:00:30.762306,Two SWAT officers responded to the Parkland rampage uninvited. They’ve been punished.,keypuncher,miamiherald.com,192,0 days 07:50:02.762306000,28202.762306,1
2018-03-08 05:03:58,2018-03-09 04:00:30.762423,"71-year-old Seattle woman pistol-whipped by teens, shot in home invasion robbery",9magsz,q13fox.com,154,0 days 22:56:32.762423000,82592.76242300001,1
2018-03-08 05:58:27,2018-03-09 04:00:30.762540,Florida lawmakers vote to stay in Daylight Saving Time all year long,Arlitto,cnn.com,149,0 days 22:02:03.762540000,79323.76254000001,1
2018-03-08 06:38:57,2018-03-09 04:00:30.762658,South Africans Raise Money Within 24 hours for Triathlete who was Victim of Chainsaw Attack,NeThZOR,news24.com,146,0 days 21:21:33.762658000,76893.762658,1
2018-03-08 23:33:01,2018-03-09 04:00:30.762773,"Toys R Us is preparing to liquidate its U.S. operations, sources say",FowelBallz,latimes.com,172,0 days 04:27:29.762773000,16049.762773,1
2018-03-08 14:32:23,2018-03-09 04:00:30.762889,"Derrius Guice: NFL teams asked if I like men, whether mother 'sells herself'",beach-bum,theguardian.com,131,0 days 13:28:07.762889000,48487.762889000005,1
2018-03-08 22:52:24,2018-03-09 04:00:30.763003,Mississippi passes law banning abortion after 15 weeks,cookiesandmilk41790,nbcnews.com,131,0 days 05:08:06.763003000,18486.763003,1
2018-03-08 15:29:50,2018-03-09 04:00:30.763119,"14-year-old accused of posing as sheriff's deputy, conducting traffic stop and house calls",Amcal,latimes.com,111,0 days 12:30:40.763119000,45040.763119,1
2018-03-08 21:34:07,2018-03-09 04:00:30.763236,Secret Service employee arrested on child porn charges,chicksdigmonkeys,abcnews.go.com,126,0 days 06:26:23.763236000,23183.763236000003,1
2018-03-08 14:12:47,2018-03-09 04:00:30.763372,He admits peeing in co-worker's water but denies bad intent,djpdude,mercurynews.com,105,0 days 13:47:43.763372000,49663.763372,1
2018-03-08 20:00:24,2018-03-09 04:00:30.763455,AP: Canada and Mexico Exempt From Tariffs on Steel and Aluminum Indefinitely,dgr8one,apnews.com,107,0 days 08:00:06.763455000,28806.763455,1
2018-03-08 06:00:14,2018-03-09 04:00:30.763536,Protesters disrupt speech by author at Lewis & Clark Law School,Valsetz,statesmanjournal.com,81,0 days 22:00:16.763536000,79216.763536,1
2018-03-08 14:54:13,2018-03-09 04:00:30.763615,"Michigan funeral home shut down after human cremains found near ashes of dog, pet pig",craponapoopstick,mlive.com,73,0 days 13:06:17.763615000,47177.763615,1
2018-03-08 04:23:09,2018-03-09 04:00:30.763694,Suspect in fatal hit-and-run wanted by ICE; sheriff’s department refuses to honor detainer,MrMischiefVIP,kdvr.com,70,0 days 23:37:21.763694000,85041.76369400001,1
2018-03-08 21:56:20,2018-03-09 04:00:30.763773,Superintendent: Metal detectors at an Alabama high school weren't in use the day a 17-year-old girl was fatally shot.,Aaaahhhhhhhh_,abcnews.go.com,71,0 days 06:04:10.763773000,21850.763773000002,1
2018-03-08 23:49:08,2018-03-09 04:00:30.763852,Oral sex is causing an oral cancer epidemic in men by outwitting natural defenses,Amcal,sacbee.com,92,0 days 04:11:22.763852000,15082.763852,1
2018-03-08 13:20:37,2018-03-09 04:00:30.763931,Cigna buying St. Louis-based Express Scripts for $67B,iWORKBRiEFLY,kmov.com,61,0 days 14:39:53.763931000,52793.763931,1
2018-03-08 15:50:46,2018-03-09 04:00:30.764009,Sick Venezuelans flee to Colombia in mounting refugee crisis,Mr-Waffles,abcnews.go.com,62,0 days 12:09:44.764009000,43784.764009000006,1
2018-03-08 03:53:08,2018-03-09 04:00:30.764088,Montreal Children’s Hospital doctor charged with theft of fentanyl,GriffonsChainsaw,globalnews.ca,58,1 days 00:07:22.764088000,86842.76408800001,1
2018-03-08 23:08:58,2018-03-09 04:00:30.764167,Right-wing activists target Berkeley's Revolution Books again,VocaMae,berkeleyside.com,58,0 days 04:51:32.764167000,17492.764167,1
2018-03-08 18:47:22,2018-03-09 04:00:30.764246,Family Dollar Employee Arrested For Shooting Shoplifter,Lionel_Hutz_Law,newschannel5.com,57,0 days 09:13:08.764246000,33188.764246,1
2018-03-08 15:07:10,2018-03-09 04:00:30.764324,"Thomas Jessell, renowned developmental neuroscientist, fired from Columbia University",bigbadler,nytimes.com,50,0 days 12:53:20.764324000,46400.764324,1
2018-03-08 20:03:55,2018-03-09 04:00:30.764404,KFC goes back to old supplier after restaurant delivery crisis,AcxdBxmb,news.sky.com,47,0 days 07:56:35.764404000,28595.764404,1
2018-03-08 15:26:38,2018-03-09 04:00:30.764484,A Texas doctor who says marijuana hurts people's brains spoke with the Oklahoma Medical Board and others on Wednesday about what he calls the dangers of the drug.,SomeGuyNotBn,koco.com,48,0 days 12:33:52.764484000,45232.764484,1
2018-03-08 07:22:51,2018-03-09 04:00:30.764562,Terry Crews' sexual assault case against Adam Venit rejected by city attorney.,BillOakley,thewrap.com,43,0 days 20:37:39.764562000,74259.76456200001,1
2018-03-08 09:59:15,2018-03-09 04:00:30.764640,Danish inventor denies murder in Swedish journalist death trial - lawyer,RubbySimons,in.reuters.com,37,0 days 18:01:15.764640000,64875.76464,0
2018-03-08 18:48:09,2018-03-09 04:00:30.764718,Magnitude 7.1 quake strikes east of Papua New Guinea island,covfefe3000,aol.com,42,0 days 09:12:21.764718000,33141.764718,0
2018-03-08 07:57:00,2018-03-09 04:00:30.764797,White House softens trade tariff stance as China enters the fray,boppinmule,news.sky.com,40,0 days 20:03:30.764797000,72210.76479700001,0
2018-03-08 18:39:11,2018-03-09 04:00:30.764875,"New Canadian $10 bill featuring civil rights activist Viola Desmond unveiled. Desmond refused to give up seat at N.S. movie theatre in 1946, years before Rosa Parks's act of defiance",headtailgrep,cbc.ca,36,0 days 09:21:19.764875000,33679.764875,0
2018-03-08 14:30:21,2018-03-09 04:00:30.764954,Navajo Tribe: Ramah Chapter prez lost $1.07 million investment,AudibleNod,navajotimes.com,35,0 days 13:30:09.764954000,48609.764954000006,0
2018-03-08 03:13:43,2018-03-09 04:00:30.765034,"Colorado family purchases, eats decades-old cereal bought from local Walmart",washheightsboy3,thedenverchannel.com,33,1 days 00:46:47.765034000,89207.76503400001,0
2018-03-08 14:08:20,2018-03-09 04:00:30.765113,Russian state TV anchor warns 'traitors',Rdaleric,bbc.co.uk,35,0 days 13:52:10.765113000,49930.765113,0
2018-03-08 10:15:11,2018-03-09 04:00:30.765192,"Akron man sentenced for assaulting children, impersonating cop for fake 'scared-straight' program",chicksdigmonkeys,cleveland.com,32,0 days 17:45:19.765192000,63919.765192000006,0
2018-03-08 18:55:45,2018-03-09 04:00:30.765271,8-day-old Lee County child dies after dog mauling,bipbopcosby,wcyb.com,28,0 days 09:04:45.765271000,32685.765271000004,0
2018-03-08 16:24:48,2018-03-09 04:00:30.765352,Stopping Traffic For Dignitaries Should Not Exceed 10 Minutes: India High Court,Professional-Name,ndtv.com,29,0 days 11:35:42.765352000,41742.765352,0
2018-03-08 05:18:01,2018-03-09 04:00:30.765432,Loud boom heard across Grays Harbor County,CheeseDust,king5.com,28,0 days 22:42:29.765432000,81749.765432,0
2018-03-08 23:57:11,2018-03-09 04:00:30.765511,"She ran over her ‘sugar daddy’ when he got tired of buying her things, Georgia DA says",Kaylabel,kansascity.com,34,0 days 04:03:19.765511000,14599.765511000001,0
2018-03-08 23:09:23,2018-03-09 04:00:30.765589,Applebee's customers who used credit cards subject to data breach,jjboggs,kgun9.com,28,0 days 04:51:07.765589000,17467.765589000002,0
2018-03-08 19:59:00,2018-03-09 04:00:30.765668,"Gunnison woman shot son, buried him in deep hole with sheep heads to settle family feud over $3 million ranch, according to court records",kidbom,denverpost.com,25,0 days 08:01:30.765668000,28890.765668,0
2018-03-08 20:53:27,2018-03-09 04:00:30.765748,Police zero in on person of interest after 17-year-old girl shot dead at school,cookiesandmilk41790,abcnews.go.com,26,0 days 07:07:03.765748000,25623.765748,0
2018-03-08 04:45:27,2018-03-09 04:00:30.765827,Full MH370 report to be released after latest search for the missing plane ends,jagershotzz,cnbc.com,23,0 days 23:15:03.765827000,83703.76582700001,0
2018-03-08 20:27:44,2018-03-09 04:00:30.765906,Cops: Man got girl out of school 10 times; now both missing,Kaylabel,wral.com,24,0 days 07:32:46.765906000,27166.765906,0
2018-03-09 00:47:32,2018-03-09 04:00:30.765985,"Remains found in wooded area identified as Christina Morris, missing since 2014",cookiesandmilk41790,nbcnews.com,31,0 days 03:12:58.765985000,11578.765985,0
2018-03-08 12:46:25,2018-03-09 04:00:30.766064,Ontario passes ‘Rowan’s Law’ to prevent concussions in young athletes,headtailgrep,globalnews.ca,20,0 days 15:14:05.766064000,54845.766064,0
2018-03-09 00:02:07,2018-03-09 04:00:30.766143,CMU shooter James Davis had fled hospital hours before allegedly killing parents,craponapoopstick,mlive.com,25,0 days 03:58:23.766143000,14303.766143,0
2018-03-08 23:12:24,2018-03-09 04:00:30.766222,"USS John S McCain collision in Singapore waters due to 'sudden turn' by US warship, says MOT",MyWholeTeamsDead,channelnewsasia.com,25,0 days 04:48:06.766222000,17286.766222000002,0
2018-03-08 15:12:44,2018-03-09 04:00:30.766301,"Accused Parkland shooter sent texts moments before opening fire, attorney says",MothrTucker,fox13memphis.com,23,0 days 12:47:46.766301000,46066.766301,0
2018-03-08 23:37:22,2018-03-09 04:00:30.766381,Police: Man shot to death after answering door,all4bs,detroitnews.com,20,0 days 04:23:08.766381000,15788.766381000001,0
2018-03-09 00:10:46,2018-03-09 04:00:30.766461,Indiana man charged in beating deaths of 2 stolen dogs,jebotionmater,apnews.com,19,0 days 03:49:44.766461000,13784.766461000001,0
2018-03-08 10:51:30,2018-03-09 04:00:30.766541,Lawmakers fear arming school staff could harm black and Hispanic students,cookiesandmilk41790,cnn.com,19,0 days 17:09:00.766541000,61740.766541000005,0
2018-03-08 19:28:54,2018-03-09 04:00:30.766620,Wife of Iranian-Canadian Who Died in Jail Is Barred from Leaving Iran,D2theCCNP,nytimes.com,17,0 days 08:31:36.766620000,30696.766620000002,0
2018-03-08 11:54:02,2018-03-09 04:00:30.766699,"Storm moves up East Coast dumping snow, knocking out power",cookiesandmilk41790,cnbc.com,17,0 days 16:06:28.766699000,57988.76669900001,0
2018-03-08 11:06:35,2018-03-09 04:00:30.766779,U.S. issues travel warning for popular Mexican tourist city,cookiesandmilk41790,cbsnews.com,18,0 days 16:53:55.766779000,60835.766779000005,0
2018-03-08 19:29:19,2018-03-09 04:00:30.766859,"Girl, 11, dies after being struck by loose wheel in Manby",Mr_Roy18,bbc.com,13,0 days 08:31:11.766859000,30671.766859000003,0
2018-03-08 17:30:48,2018-03-09 04:00:30.766937,Spanish women hold nationwide strike against inequality and macho culture | Reuters,Professional-Name,in.reuters.com,13,0 days 10:29:42.766937000,37782.766937,0
2018-03-08 15:25:52,2018-03-09 04:00:30.767017,Video of Orangutan Smoking at Bandung Zoo Sparks Outrage,Plainchant,time.com,12,0 days 12:34:38.767017000,45278.767017000006,0
2018-03-08 13:33:47,2018-03-09 04:00:30.767105,Sanofi may seek U.S. approval for Dengvaxia despite Philippines outrage,Golden-Elevator,reuters.com,13,0 days 14:26:43.767105000,52003.767105000006,0
2018-03-09 00:16:41,2018-03-09 04:00:30.767186,Child sexual abuse inquiry considers Jehovah's Witnesses UK investigation,Alex09464367,theguardian.com,14,0 days 03:43:49.767186000,13429.767186000001,0
2018-03-08 19:32:58,2018-03-09 04:00:30.767265,Harlan KSP Threatens Local Media Outlets Causing First Amendment Debate,Justifiably_Cynical,lex18.com,14,0 days 08:27:32.767265000,30452.767265000002,0
2018-03-08 04:25:50,2018-03-09 04:00:30.767354,YMCA chief executive officer resigns after 22-month tenure,GriffonsChainsaw,kcci.com,11,0 days 23:34:40.767354000,84880.76735400001,0
2018-03-08 03:53:14,2018-03-09 04:00:30.767437,UnitedHealthcare adds the Apple Watch to its fitness-tracking reward program,GriffonsChainsaw,theverge.com,13,1 days 00:07:16.767437000,86836.767437,0
2018-03-08 15:10:02,2018-03-09 04:00:30.767516,Hyderabad Woman Thrashed By Husband For Disconnecting Wi-Fi,Prettygame4Ausername,ndtv.com,15,0 days 12:50:28.767516000,46228.767516,0
2018-03-08 09:35:22,2018-03-09 04:00:30.767596,Algerian president calls for action on migrant criminal networks,interestuff,washingtonpost.com,14,0 days 18:25:08.767596000,66308.767596,0
2018-03-08 07:07:38,2018-03-09 04:00:30.767675,Immigrant's meth conviction reversed over deportation confusion,Valsetz,oregonlive.com,11,0 days 20:52:52.767675000,75172.76767500001,0
2018-03-08 07:07:36,2018-03-09 04:00:30.767756,Destitute Rohingya in 'race against time' as Mother Nature bears down,Benson685,nbcnews.com,12,0 days 20:52:54.767756000,75174.767756,0
2018-03-08 20:35:42,2018-03-09 04:00:30.767835,Pilots soar into history as Manitoba's 1st female Indigenous medevac team,Unkinkedwolf,cbc.ca,11,0 days 07:24:48.767835000,26688.767835000002,0
2018-03-08 13:27:02,2018-03-09 04:00:30.767914,"Sources: Abbas suffering from health issues, avoiding being filmed",DingDongInDaPingPong,i24news.tv,11,0 days 14:33:28.767914000,52408.767914000004,0
2018-03-08 11:32:18,2018-03-09 04:00:30.767993,Carl Icahn: Any suggestion of insider trading on Manitowoc is 'categorically untrue',dangerouslesbian,cnbc.com,8,0 days 16:28:12.767993000,59292.767993,0
2018-03-08 07:29:55,2018-03-09 04:00:30.768072,Alleged Barwon-Darling water thieves to be prosecuted after ABC investigation,zim555,abc.net.au,9,0 days 20:30:35.768072000,73835.768072,0
2018-03-09 01:49:51,2018-03-09 04:00:30.768150,Women in Syria 'forced to exchange sexual favours' for UN aid,salawm,telegraph.co.uk,22,0 days 02:10:39.768150000,7839.768150000001,0
2018-03-08 16:15:03,2018-03-09 04:00:30.768228,Cigna to spend about $52 billion for Express Scripts,cookiesandmilk41790,apnews.com,9,0 days 11:45:27.768228000,42327.768228,0
2018-03-08 13:33:42,2018-03-09 04:00:30.768307,"Russian spy: Attack was 'brazen and reckless', says Amber Rudd",Mr_Roy18,bbc.com,9,0 days 14:26:48.768307000,52008.768307000006,0
2018-03-08 06:44:04,2018-03-09 04:00:30.768386,11-Year-Old Girl in Custody After Cloquet School Threat,nosotros_road_sodium,fox21online.com,12,0 days 21:16:26.768386000,76586.76838600001,0
2018-03-09 02:39:40,2018-03-09 04:00:30.768465,"Asheville, NC, cop charged and arrested",treykindlinger,citizen-times.com,25,0 days 01:20:50.768465000,4850.768465,0
2018-03-08 22:58:05,2018-03-09 04:00:30.768544,Scientists develop pigs for transplants,KermitMadMan,the-japan-news.com,9,0 days 05:02:25.768544000,18145.768544000002,0
